ID,Parent Interest ID,Summary,Registration Date,Published Date,Updated Date,Category,Member,MNIS ID,AroseOn,EndDate,DonorName,Description,MiscellaneousInterestType
1921,,"Bursary Campaign Ambassador for St. Peter’s School, York (registered charity). This is an unpaid role.",01/06/2022,17/12/2023,,Miscellaneous,Alan Mak,4484,01/06/2022,,,"Bursary Campaign Ambassador for St. Peter’s School, York (registered charity). This is an unpaid role.",Unpaid role
2081,,"Associate Tenant, Doughty Street Chambers",06/01/2016,17/12/2023,,Miscellaneous,Sir Keir Starmer,4514,01/05/2015,,,"Associate Tenant, Doughty Street Chambers",Other
1394,,"Vice President of the Local Government Association (LGA), which works with councils to support, promote and improve local government.",20/11/2020,17/12/2023,,Miscellaneous,Daisy Cooper,4769,10/03/2020,,,"Vice President of the Local Government Association (LGA), which works with councils to support, promote and improve local government.",Unpaid role
1926,,"A member of the Advisory Council for the Council on Geostrategy, an independent non-profit organisation that generates new geostrategic thinking for a more competitive age. This is an unpaid role.",09/06/2023,17/12/2023,,Miscellaneous,Richard Foord,4942,23/05/2023,,,"A member of the Advisory Council for the Council on Geostrategy, an independent non-profit organisation that generates new geostrategic thinking for a more competitive age. This is an unpaid role.",Unpaid role
1951,,"A Member and Director of Stop Fire and Rehire Ltd, a company limited by guarantee set up to manage financial support for my Private Members Bill campaign. The company is a not for profit company and the position is entirely unpaid.",10/09/2021,17/12/2023,,Miscellaneous,Barry Gardiner,146,06/07/2021,,,"A Member and Director of Stop Fire and Rehire Ltd, a company limited by guarantee set up to manage financial support for my Private Members Bill campaign. The company is a not for profit company and the position is entirely unpaid.",Unpaid role
1957,,Member of the Court of the Worshipful Company of Coachmakers and Coach Harness Makers of London.,,17/12/2023,19/05/2015,Miscellaneous,Mark Garnier,4074,,,,Member of the Court of the Worshipful Company of Coachmakers and Coach Harness Makers of London.,Other
1438,,"Vice Chair of the HOPE not Hate Parliamentary Group, an anti-racism campaign organisation. This is an unpaid position.",15/10/2020,17/12/2023,,Miscellaneous,Sarah Owen,4777,14/09/2020,,,"Vice Chair of the HOPE not Hate Parliamentary Group, an anti-racism campaign organisation. This is an unpaid position.",Unpaid role
1494,,I was appointed as a member of the Board of the Westminster Foundation for Democracy for a three-year term. This is an unpaid role.,26/09/2022,17/12/2023,,Miscellaneous,Yasmin Qureshi,3924,07/09/2022,,,I was appointed as a member of the Board of the Westminster Foundation for Democracy for a three-year term. This is an unpaid role.,Unpaid role
2145,,"Chair of the China Research Group, a company limited by guarantee which considers the longer term challenges arising from the rise of China and hosts relevant events online. This is an unpaid role.",06/11/2020,17/12/2023,22/01/2024,Miscellaneous,Tom Tugendhat,4462,25/04/2020,22/09/2022,,"Chair of the China Research Group, a company limited by guarantee which considers the longer term challenges arising from the rise of China and hosts relevant events online. This is an unpaid role.",Unpaid role
1539,,Solicitor (currently non-practising).,,17/12/2023,,Miscellaneous,Catherine McKinnell,4125,,,,Solicitor (currently non-practising).,Other
2006,,"Sole Trader, Christine Jardine Communications (inactive), media consultancy.",06/07/2017,17/12/2023,,Miscellaneous,Christine Jardine,4634,,,,"Sole Trader, Christine Jardine Communications (inactive), media consultancy.",Other
1872,,"Governor of Dickson Primary School, Lurgan, Magheralin Primary School and Lurgan Junior High School.",03/02/2020,17/12/2023,,Miscellaneous,Carla Lockhart,4857,,,,"Governor of Dickson Primary School, Lurgan, Magheralin Primary School and Lurgan Junior High School.",Unpaid role
1472,,"A Trustee of the Sisters Trust, a registered charity that makes donations to organisations committed to challenging racial and sexual inequality. This is an unpaid role.",18/06/2020,17/12/2023,24/06/2020,Miscellaneous,Rushanara Ali,4138,16/05/2020,,,"A Trustee of the Sisters Trust, a registered charity that makes donations to organisations committed to challenging racial and sexual inequality. This is an unpaid role.",Unpaid role
1512,,Director of the Commonwealth Parliamentary Association UK. This is an unpaid role.,08/08/2023,17/12/2023,,Miscellaneous,Andrew Rosindell,1447,07/07/2010,,,Director of the Commonwealth Parliamentary Association UK. This is an unpaid role.,Unpaid role
1540,,A Trustee and Vice Chair of the Board of the Industry and Parliament Trust. This is an unpaid role.,07/03/2023,17/12/2023,,Miscellaneous,Catherine McKinnell,4125,26/02/2020,,,A Trustee and Vice Chair of the Board of the Industry and Parliament Trust. This is an unpaid role.,Unpaid role
1588,,Director of 100MPH Events Limited (dormant). This is an unpaid role.,31/07/2023,17/12/2023,,Miscellaneous,Ian Murray,3966,22/10/2001,,,Director of 100MPH Events Limited (dormant). This is an unpaid role.,Unpaid role
1604,,"A Vice President of Combat Stress, a charity offering mental health services to veterans. This is an unpaid role.",15/12/2021,17/12/2023,,Miscellaneous,Sir Bernard Jenkin,40,,,,"A Vice President of Combat Stress, a charity offering mental health services to veterans. This is an unpaid role.",Unpaid role
1607,,"Chair of Rebalancing the Outer Estates Foundation, a charity that works in partnership with a range of organisations to deliver positive change in Nottingham North, with particular focus on the areas of health, community, arts and creativity, and employment. This is an unpaid role.",03/11/2020,17/12/2023,,Miscellaneous,Alex Norris,4641,,,,"Chair of Rebalancing the Outer Estates Foundation, a charity that works in partnership with a range of organisations to deliver positive change in Nottingham North, with particular focus on the areas of health, community, arts and creativity, and employment. This is an unpaid role.",Unpaid role
1629,,"Trustee of the Royal Court Theatre, Liverpool. This is an unpaid role.",26/04/2022,17/12/2023,,Miscellaneous,Kim Johnson,4824,08/04/2022,,,"Trustee of the Royal Court Theatre, Liverpool. This is an unpaid role.",Unpaid role
1665,,Board Member of the West Midlands Reserve Forces and Cadets Association.,10/01/2020,17/12/2023,,Miscellaneous,Saqib Bhatti,4818,,,,Board Member of the West Midlands Reserve Forces and Cadets Association.,Other
1689,,"A non-Executive Director of The Oxford Group, whose programmes include initiatives to develop sustainable communities; making films about conflict resolution; working to bring trust and integrity into the business and financial sectors; helping young people to find a sense of vocation. This is an unpaid role.",13/09/2022,17/12/2023,,Miscellaneous,Mike Kane,4316,28/05/2022,,,"A non-Executive Director of The Oxford Group, whose programmes include initiatives to develop sustainable communities; making films about conflict resolution; working to bring trust and integrity into the business and financial sectors; helping young people to find a sense of vocation. This is an unpaid role.",Unpaid role
1688,,Vice-Chairman of the Conservative Party.,11/01/2021,17/12/2023,30/07/2021,Miscellaneous,Andrew Bowie,4601,28/07/2019,,,Vice-Chairman of the Conservative Party.,Formal role with a party organisation
1729,,Non-practising solicitor.,06/06/2015,17/12/2023,,Miscellaneous,Richard Burgon,4493,,,,Non-practising solicitor.,Other
1731,,"Unpaid Chair of the Brazil Solidarity Initiative, a network established to campaign for human rights in Brazil.",24/03/2023,17/12/2023,,Miscellaneous,Richard Burgon,4493,22/11/2018,,,"Unpaid Chair of the Brazil Solidarity Initiative, a network established to campaign for human rights in Brazil.",Unpaid role
1829,,I am a member of the Law Society of England and Wales.,26/06/2017,17/12/2023,,Miscellaneous,John Lamont,4608,,,,I am a member of the Law Society of England and Wales.,Other
1830,,I am a trustee of the St Abbs Lifeboat Trust.,26/06/2017,17/12/2023,,Miscellaneous,John Lamont,4608,,,,I am a trustee of the St Abbs Lifeboat Trust.,Unpaid role
1849,,"Registered Nurse at the Bank Universities Hospitals, Birmingham.",21/03/2022,17/12/2023,,Miscellaneous,Paulette Hamilton,4938,,,,"Registered Nurse at the Bank Universities Hospitals, Birmingham.",Other
1967,,"Unpaid Vice President of the LGA, which works with councils to support, promote and improve local government.",09/03/2021,17/12/2023,,Miscellaneous,Rachel Hopkins,4873,30/12/2020,,,"Unpaid Vice President of the LGA, which works with councils to support, promote and improve local government.",Unpaid role
2055,,An unpaid Vice-President of the Local Government Association (LGA).,21/10/2020,17/12/2023,,Miscellaneous,David Simmonds,4872,19/10/2020,,,An unpaid Vice-President of the Local Government Association (LGA).,Unpaid role
2061,,Barrister (not practising),,17/12/2023,,Miscellaneous,Andy Slaughter,1516,,,,Barrister (not practising),Other
2099,,"Unremunerated trustee of the Global Warming Policy Foundation, an education charity.",23/10/2015,17/12/2023,,Miscellaneous,Graham Stringer,449,01/10/2015,,,"Unremunerated trustee of the Global Warming Policy Foundation, an education charity.",Unpaid role
2101,,"Member (unpaid) of the Political Advisory Board of the Foundation for Independence, a pro-Brexit group.",22/05/2020,17/12/2023,,Miscellaneous,Graham Stringer,449,01/04/2020,,,"Member (unpaid) of the Political Advisory Board of the Foundation for Independence, a pro-Brexit group.",Unpaid role
2117,,Non-practising barrister.,,17/12/2023,,Miscellaneous,Emily Thornberry,1536,,,,Non-practising barrister.,Other
2120,,"Chair of Trustees, Traidcraft Foundation.",10/05/2018,17/12/2023,,Miscellaneous,Sir Stephen Timms,163,,,,"Chair of Trustees, Traidcraft Foundation.",Unpaid role
1407,,"Trustee of Tourism for all, a charity.",06/07/2017,17/12/2023,,Miscellaneous,Ed Davey,188,,,,"Trustee of Tourism for all, a charity.",Unpaid role
1960,,"Director of the Satellite Finance Network, a company limited by guarantee providing support and advice for space sector start-up companies. This is an unpaid role, requiring one day per month commitment.",15/03/2021,17/12/2023,,Miscellaneous,Mark Garnier,4074,10/03/2021,,,"Director of the Satellite Finance Network, a company limited by guarantee providing support and advice for space sector start-up companies. This is an unpaid role, requiring one day per month commitment.",Unpaid role
1966,,A Non-executive Director of Space Solar Group Holdings Ltd. A UK company established to lead the development of space based solar power. This is an unpaid role.,09/01/2023,17/12/2023,28/06/2023,Miscellaneous,Mark Garnier,4074,09/01/2023,,,A Non-executive Director of Space Solar Group Holdings Ltd. A UK company established to lead the development of space based solar power. This is an unpaid role.,Unpaid role
1450,,A company in which Millgap Ltd holds beneficial ownership of 0.375% became accredited for the Coronavirus Business Interruption Loan Scheme.,25/05/2021,17/12/2023,,Miscellaneous,Chris Philp,4503,22/03/2021,,,A company in which Millgap Ltd holds beneficial ownership of 0.375% became accredited for the Coronavirus Business Interruption Loan Scheme.,Other
2084,,"Solicitor, non-practising since 8 May 2015.",19/07/2021,17/12/2023,,Miscellaneous,Jo Stevens,4425,,,,"Solicitor, non-practising since 8 May 2015.",Other
1406,,"Board Member (unpaid) of Fit for the Future, a network of mainly charities helping organisations to become climate-friendly and resilient.",06/07/2017,17/12/2023,31/01/2020,Miscellaneous,Ed Davey,188,,,,"Board Member (unpaid) of Fit for the Future, a network of mainly charities helping organisations to become climate-friendly and resilient.",Unpaid role
1437,,Director of Vintage Ghetto (unpaid).,10/08/2023,17/12/2023,,Miscellaneous,Sarah Dyke,4995,,,,Director of Vintage Ghetto (unpaid).,Unpaid role
1976,,Member of the British Equine Veterinary Association.,07/01/2020,17/12/2023,,Miscellaneous,Dr Neil Hudson,4853,,,,Member of the British Equine Veterinary Association.,Other
1993,,"Barrister, not currently practising.",04/06/2015,17/12/2023,,Miscellaneous,Imran Hussain,4394,,,,"Barrister, not currently practising.",Other
1508,,"Chair of EastSide Tourism Ltd, which promotes East Belfast as a tourist destination. This is an unpaid role.",06/08/2019,17/12/2023,,Miscellaneous,Gavin Robinson,4360,01/08/2019,,,"Chair of EastSide Tourism Ltd, which promotes East Belfast as a tourist destination. This is an unpaid role.",Unpaid role
1535,,Solicitor (not currently employed as such).,28/12/2012,17/12/2023,,Miscellaneous,Andy McDonald,4269,,,,Solicitor (not currently employed as such).,Other
1547,,"Trustee (Unpaid) of ""If Chloe Can""; charity providing careers advice and support for young people.",07/07/2017,17/12/2023,,Miscellaneous,Esther McVey,4084,,,,"Trustee (Unpaid) of ""If Chloe Can""; charity providing careers advice and support for young people.",Unpaid role
1613,,"A member of the advisory board of Onward, a think tank which aims to produce modernising ideas to address some of the biggest challenges facing the UK. This is an unpaid role.",16/06/2020,17/12/2023,,Miscellaneous,Neil O'Brien,4679,25/04/2018,,,"A member of the advisory board of Onward, a think tank which aims to produce modernising ideas to address some of the biggest challenges facing the UK. This is an unpaid role.",Unpaid role
1628,,Member of the Liverpool City Region Freeport Board. This is an unpaid role.,22/04/2022,17/12/2023,,Miscellaneous,Kim Johnson,4824,11/04/2022,,,Member of the Liverpool City Region Freeport Board. This is an unpaid role.,Unpaid role
1722,,A Member of the Executive Committee of the Commonwealth Parliamentary Association (UK Branch). This is an unpaid role.,11/08/2023,17/12/2023,,Miscellaneous,Dame Harriett Baldwin,4107,28/01/2020,,,A Member of the Executive Committee of the Commonwealth Parliamentary Association (UK Branch). This is an unpaid role.,Unpaid role
1744,,"Member of the Commission on Alcohol Harm, established by the Alcohol Harm Alliance (a consortium of over 50 non-governmental organisations) to promote evidence based policies to reduce the harm caused by alcohol.",07/07/2021,17/12/2023,,Miscellaneous,Dan Carden,4651,24/06/2021,,,"Member of the Commission on Alcohol Harm, established by the Alcohol Harm Alliance (a consortium of over 50 non-governmental organisations) to promote evidence based policies to reduce the harm caused by alcohol.",Other
1781,,"A Trustee of Fields in Trust (FiT), a charity which champions and supports our parks and green spaces. This is an unpaid role.",29/09/2022,17/12/2023,,Miscellaneous,Mr Clive Betts,394,28/01/2021,,,"A Trustee of Fields in Trust (FiT), a charity which champions and supports our parks and green spaces. This is an unpaid role.",Unpaid role
1814,,"Unpaid adviser to Pomeroon Trading Inc, an environmentally sustainable company that grows and exports coconuts and agricultural produce. I provide advice on Guyana, the Caribbean and on the company’s community development fund. I hold share options below the level for registration under the category for Shareholdings.",18/02/2019,17/12/2023,,Miscellaneous,Mr David Lammy,206,01/01/2019,,,"Unpaid adviser to Pomeroon Trading Inc, an environmentally sustainable company that grows and exports coconuts and agricultural produce. I provide advice on Guyana, the Caribbean and on the company’s community development fund. I hold share options below the level for registration under the category for Shareholdings.",Unpaid role
1835,,"Member of Wilton Park Advisory Council, a not-for-profit executive agency of the Foreign and Commonwealth Office which organises events that bring together leading representatives from politics, diplomacy, academia, business, civil society, the military and the media. This is an unpaid role.",06/07/2020,17/12/2023,,Miscellaneous,Andrew Griffith,4874,01/07/2020,,,"Member of Wilton Park Advisory Council, a not-for-profit executive agency of the Foreign and Commonwealth Office which organises events that bring together leading representatives from politics, diplomacy, academia, business, civil society, the military and the media. This is an unpaid role.",Unpaid role
1919,,"Ambassador for The Blossom Awards (non-profit initiative for the British-Chinese community, administered by my partner’s company). This is an unpaid role.",08/01/2020,17/12/2023,,Miscellaneous,Alan Mak,4484,01/01/2020,,,"Ambassador for The Blossom Awards (non-profit initiative for the British-Chinese community, administered by my partner’s company). This is an unpaid role.",Unpaid role
1979,,Member of the British Horseracing Authority Whip Review Steering Group (2021/22). This is an unpaid role.,27/04/2021,17/12/2023,,Miscellaneous,Dr Neil Hudson,4853,27/04/2021,,,Member of the British Horseracing Authority Whip Review Steering Group (2021/22). This is an unpaid role.,Unpaid role
2105,,"Director of Zarah Sultana Campaigns Ltd, which helps my political campaigning activity. This is an unpaid role.",24/03/2023,17/12/2023,,Miscellaneous,Zarah Sultana,4786,12/11/2021,,,"Director of Zarah Sultana Campaigns Ltd, which helps my political campaigning activity. This is an unpaid role.",Unpaid role
2112,,"Barrister, not currently practising.",03/06/2015,17/12/2023,,Miscellaneous,Nick Thomas-Symonds,4479,,,,"Barrister, not currently practising.",Other
1641,,I am the director of the Henacre Charitable Fund (the “Henacre Trust”) launched on 8 March 2019. This is a named trust owned and operated by the Quartet Community Foundation on my behalf. The Henacre Trust will make charitable grants to young people from Bristol North West.,11/03/2019,17/12/2023,,Miscellaneous,Darren Jones,4621,08/03/2019,,,I am the director of the Henacre Charitable Fund (the “Henacre Trust”) launched on 8 March 2019. This is a named trust owned and operated by the Quartet Community Foundation on my behalf. The Henacre Trust will make charitable grants to young people from Bristol North West.,Unpaid role
1493,,Member of Bolton Town Board. This is an unpaid role.,08/06/2020,17/12/2023,,Miscellaneous,Yasmin Qureshi,3924,27/01/2020,,,Member of Bolton Town Board. This is an unpaid role.,Unpaid role
1389,,Fellow of the Royal Institute of Chartered Surveyors (unremunerated).,,17/12/2023,,Miscellaneous,Sir Geoffrey Clifton-Brown,249,,,,Fellow of the Royal Institute of Chartered Surveyors (unremunerated).,Unpaid role
1898,,Minor interest in a house in Caerphilly County Borough area owned by two members of my family.,06/06/2016,17/12/2023,,Miscellaneous,Chris Elmore,4572,,,,Minor interest in a house in Caerphilly County Borough area owned by two members of my family.,Other
1948,,"Trustee of Climate Parliament, which aims to educate and inform legislators about climate change and policy options for promoting renewable energy. This is an unpaid role.",28/02/2019,17/12/2023,,Miscellaneous,Barry Gardiner,146,04/02/2019,,,"Trustee of Climate Parliament, which aims to educate and inform legislators about climate change and policy options for promoting renewable energy. This is an unpaid role.",Unpaid role
2023,,"Vice-President of West Midlands Labour Finance and Industry Group (WM LFIG), which exists to facilitate constructive dialogue between the Government and prominent persons from industry, finance and the professions within the West Midlands.",12/04/2019,17/12/2023,,Miscellaneous,Preet Kaur Gill,4603,10/04/2019,,,"Vice-President of West Midlands Labour Finance and Industry Group (WM LFIG), which exists to facilitate constructive dialogue between the Government and prominent persons from industry, finance and the professions within the West Midlands.",Other
2749,,A Trustee of the Parliamentary Contributory Pension Fund. This is an unpaid role.,11/08/2023,17/12/2023,,Miscellaneous,Dame Harriett Baldwin,4107,28/01/2022,,,A Trustee of the Parliamentary Contributory Pension Fund. This is an unpaid role.,Unpaid role
1446,,A trustee of the Stacy Wanjiku Welfare Trust. Having raised money for the education and welfare of Stacey Wanjiru I am a trustee of the fund. Stacey is the daughter of Agnes Wanjiru a Kenyan woman murdered in 2012 in a case linked to British Armed Forces. This is an unpaid role.,24/03/2022,17/12/2023,,Miscellaneous,Jess Phillips,4370,16/03/2022,,,A trustee of the Stacy Wanjiku Welfare Trust. Having raised money for the education and welfare of Stacey Wanjiru I am a trustee of the fund. Stacey is the daughter of Agnes Wanjiru a Kenyan woman murdered in 2012 in a case linked to British Armed Forces. This is an unpaid role.,Unpaid role
2436,,"Trustee (unpaid) of the Big Tent Foundation, a not-for-profit non-party foundation for the renewal of mainstream political engagement.",02/02/2018,17/12/2023,12/02/2024,Miscellaneous,George Freeman,4020,01/04/2020,17/09/2021,,"Trustee (unpaid) of the Big Tent Foundation, a not-for-profit non-party foundation for the renewal of mainstream political engagement.",Unpaid role
2142,,Holding below registrable threshold in Juliand Digital Ltd (productivity software). These shares were transferred to a blind trust in May 2023.,04/06/2015,17/12/2023,22/01/2024,Miscellaneous,Tom Tugendhat,4462,,09/05/2023,,Holding below registrable threshold in Juliand Digital Ltd (productivity software). These shares were transferred to a blind trust in May 2023.,Financial interest or material benefit
2078,,Leeds University Law Faculty Advisory Board,05/06/2015,17/12/2023,29/04/2024,Miscellaneous,Sir Keir Starmer,4514,,29/04/2024,,Leeds University Law Faculty Advisory Board,Other
1475,,"Chair of Trustees of UpRising Leadership, a registered charity providing UK-wide youth leadership development, mentoring and employability opportunities to young people from diverse and underrepresented backgrounds. This is an unpaid role.",01/12/2022,17/12/2023,,Miscellaneous,Rushanara Ali,4138,,,,"Chair of Trustees of UpRising Leadership, a registered charity providing UK-wide youth leadership development, mentoring and employability opportunities to young people from diverse and underrepresented backgrounds. This is an unpaid role.",Unpaid role
1548,,"Unpaid Director of Blue Collar Productions, a television production company of Miryfields Cottage, 5/7 Cann Street, Tottington BL8 3PE.",29/10/2020,17/12/2023,,Miscellaneous,Esther McVey,4084,01/10/2020,,,"Unpaid Director of Blue Collar Productions, a television production company of Miryfields Cottage, 5/7 Cann Street, Tottington BL8 3PE.",Unpaid role
1582,,Advisory Board Member to the Centre for Commonwealth Affairs. This is an unpaid role.,15/08/2023,17/12/2023,,Miscellaneous,Wendy Morton,4358,09/08/2023,,,Advisory Board Member to the Centre for Commonwealth Affairs. This is an unpaid role.,Unpaid role
1590,,Director of the Commonwealth Parliamentary Association (United Kingdom).,31/07/2023,17/12/2023,,Miscellaneous,Ian Murray,3966,12/07/2017,,,Director of the Commonwealth Parliamentary Association (United Kingdom).,Unpaid role
1598,,"A Trustee of the UK Reserve Forces Association, which is part of the MOD and promotes the efficiency of reserve forces by providing opportunities for education, personal development and international experiences. This is an unpaid role.",11/05/2022,17/12/2023,,Miscellaneous,Dr Andrew Murrison,1466,20/04/2022,,,"A Trustee of the UK Reserve Forces Association, which is part of the MOD and promotes the efficiency of reserve forces by providing opportunities for education, personal development and international experiences. This is an unpaid role.",Unpaid role
1625,,Voluntary Board Member of Liverpool Institute of Performing Arts (LIPA). This is an unpaid role.,16/07/2021,17/12/2023,,Miscellaneous,Kim Johnson,4824,25/06/2021,,,Voluntary Board Member of Liverpool Institute of Performing Arts (LIPA). This is an unpaid role.,Unpaid role
1637,,Director of the Albany Theatre Trust. This is an unpaid role.,03/08/2023,17/12/2023,,Miscellaneous,Taiwo Owatemi,4779,21/04/2021,,,Director of the Albany Theatre Trust. This is an unpaid role.,Unpaid role
1645,,Director of the Holocaust Memorial Day Trust. This is an unpaid role.,03/08/2023,17/12/2023,,Miscellaneous,Taiwo Owatemi,4779,18/07/2023,,,Director of the Holocaust Memorial Day Trust. This is an unpaid role.,Unpaid role
1687,,"Member of the Connected Coast Board, a joint board for the Mablethorpe and Skegness Towns Fund. This is an unpaid role.",28/01/2020,17/12/2023,,Miscellaneous,Victoria Atkins,4399,27/01/2020,,,"Member of the Connected Coast Board, a joint board for the Mablethorpe and Skegness Towns Fund. This is an unpaid role.",Unpaid role
1733,,"Member of the management committee, Spirit of Shankly, which promotes the interests of football supporters.",10/01/2020,17/12/2023,,Miscellaneous,Ian Byrne,4831,,,,"Member of the management committee, Spirit of Shankly, which promotes the interests of football supporters.",Other
1916,,"Trustee of Ellesmere Port and Neston Helping Hands, a charity which aims to provide poverty relief and support to residents in my constituency. This is an unpaid role.",04/12/2020,17/12/2023,,Miscellaneous,Justin Madders,4418,26/11/2020,,,"Trustee of Ellesmere Port and Neston Helping Hands, a charity which aims to provide poverty relief and support to residents in my constituency. This is an unpaid role.",Unpaid role
