ID,Parent Interest ID,Summary,Registration Date,Published Date,Updated Date,Category,Member,MNIS ID,AroseOn,EndDate,DonorName,Description,MiscellaneousInterestType
10181,,"Unpaid trustee Lifelines Arley Whitacre, a small charity.",04/08/2024,04/08/2024,,Miscellaneous,Jodie Gosling,5036,,,,"Unpaid trustee Lifelines Arley Whitacre, a small charity.",Unpaid role
10211,,Member of Euston Business Improvement District Board,04/08/2024,04/08/2024,,Miscellaneous,Georgia Gould,5305,,30/07/2024,,Member of Euston Business Improvement District Board,Unpaid role
10266,,Unpaid Director of Hope Not Hate Ltd.,04/08/2024,04/08/2024,,Miscellaneous,Anna Turley,4449,,11/07/2024,,Unpaid Director of Hope Not Hate Ltd.,Unpaid role
10233,,"Honorary surgeon, NHS Greater Glasgow and Clyde",04/08/2024,04/08/2024,,Miscellaneous,Dr Zubir Ahmed,5213,,,,"Honorary surgeon, NHS Greater Glasgow and Clyde",Formal role with a party organisation
10209,,Member of Euston Partnership Board - this was in my capacity as leader of Camden Council so ceased when I stood down from this role.,04/08/2024,04/08/2024,,Miscellaneous,Georgia Gould,5305,10/07/2024,11/07/2024,,Member of Euston Partnership Board - this was in my capacity as leader of Camden Council so ceased when I stood down from this role.,Unpaid role
10197,,Army Reservist. I have not received any earnings since being elected.,04/08/2024,04/08/2024,,Miscellaneous,Helena Dollimore,5192,,,,Army Reservist. I have not received any earnings since being elected.,Other
10166,,Associate member of Deka Chambers.,04/08/2024,04/08/2024,,Miscellaneous,Jake Richards,5082,,,,Associate member of Deka Chambers.,Other
10070,,Membership Secretary of Arnold Branch Labour Party.,04/08/2024,04/08/2024,,Miscellaneous,Michael Payne,5146,,,,Membership Secretary of Arnold Branch Labour Party.,Formal role with a party organisation
10057,,I have an unpaid role as a Councillor on Rochdale Borough Council (RBC).,04/08/2024,04/08/2024,,Miscellaneous,Mrs Elsie Blundell,5084,,,,I have an unpaid role as a Councillor on Rochdale Borough Council (RBC).,Formal role with a party organisation
10052,,LGBT+ Officer of Gedling Constituency Labour Party.,04/08/2024,04/08/2024,,Miscellaneous,Michael Payne,5146,,,,LGBT+ Officer of Gedling Constituency Labour Party.,Formal role with a party organisation
10036,,Associate member of Young Camden Foundation Board - this was a role associated with my role as Leader of Camden Council. I stepped down when I stepped down as Leader of Camden Council.,04/08/2024,04/08/2024,,Miscellaneous,Georgia Gould,5305,,11/07/2024,,Associate member of Young Camden Foundation Board - this was a role associated with my role as Leader of Camden Council. I stepped down when I stepped down as Leader of Camden Council.,Unpaid role
10035,,Co-Chair of London's Partnership Board - This role came with my role as Chair of London Councils and ceased on my resignation as Chair of London Councils.,04/08/2024,04/08/2024,,Miscellaneous,Georgia Gould,5305,,10/07/2024,,Co-Chair of London's Partnership Board - This role came with my role as Chair of London Councils and ceased on my resignation as Chair of London Councils.,Unpaid role
10010,,Unpaid role as elected councillor on Bridgnorth Town council.,03/08/2024,04/08/2024,,Miscellaneous,Julia Buckley,5171,,,,Unpaid role as elected councillor on Bridgnorth Town council.,Unpaid role
10007,,Unpaid directorship of Home Grown Life Ltd.,03/08/2024,04/08/2024,,Miscellaneous,Victoria Collins,5201,,,,Unpaid directorship of Home Grown Life Ltd.,Unpaid role
9944,,Councillor in the London Borough of Tower Hamlets.,03/08/2024,04/08/2024,,Miscellaneous,Rachel Blake,5257,,26/07/2024,,Councillor in the London Borough of Tower Hamlets.,Other
9943,,Yorkshire & Humber Labour Party Regional Executive Committee North Yorkshire CLP representative.,03/08/2024,04/08/2024,,Miscellaneous,Alison Hume,5254,,,,Yorkshire & Humber Labour Party Regional Executive Committee North Yorkshire CLP representative.,Formal role with a party organisation
9937,,Unpaid directorship of a private company (Space Republic Limited),03/08/2024,04/08/2024,,Miscellaneous,Claire Hughes,5113,,,,Unpaid directorship of a private company (Space Republic Limited),Unpaid role
9864,,"Company Director, One Nine Seven Investments Ltd and A&H Bros (& others) Investments Ltd.",03/08/2024,04/08/2024,,Miscellaneous,Mr Adnan Hussain,5231,,,,"Company Director, One Nine Seven Investments Ltd and A&H Bros (& others) Investments Ltd.",Financial interest or material benefit
9862,,Shares in a dormant company no longer trading- Holland House Property Investments Ltd,03/08/2024,04/08/2024,,Miscellaneous,Alison Taylor,5093,,,,Shares in a dormant company no longer trading- Holland House Property Investments Ltd,Financial interest or material benefit
9758,,Unpaid role of District Councillor on Cannock Chase District Council.,03/08/2024,04/08/2024,,Miscellaneous,Josh Newbury,5034,,,Ongoing role of District Councillor on Cannock Chase District Council. Unpaid as of 05/07/2024 due to fully renouncing all members' allowances.,Unpaid role of District Councillor on Cannock Chase District Council.,Unpaid role
9741,,Non-practising solicitor (regulated by the Solicitor's Regulatory Authority).,03/08/2024,04/08/2024,,Miscellaneous,Alex McIntyre,5349,,,,Non-practising solicitor (regulated by the Solicitor's Regulatory Authority).,Other
9730,,"I am a solicitor, although I left my employment as a solicitor (Associate) with Thompsons Solicitors LLP on 5 July 2024.",03/08/2024,04/08/2024,,Miscellaneous,Warinder Juss,5230,,,,"I am a solicitor, although I left my employment as a solicitor (Associate) with Thompsons Solicitors LLP on 5 July 2024.",Other
9722,,Fellowship of the Royal Institution of Chartered Surveyors.,03/08/2024,04/08/2024,,Miscellaneous,Alison Taylor,5093,,,,Fellowship of the Royal Institution of Chartered Surveyors.,Other
9720,,Shares in a privately owned company - Avison Young Canada Inc.,03/08/2024,04/08/2024,,Miscellaneous,Alison Taylor,5093,,,,Shares in a privately owned company - Avison Young Canada Inc.,Financial interest or material benefit
9718,,Fellow of the Faculty of Public Health.,03/08/2024,04/08/2024,,Miscellaneous,Dr Beccy Cooper,5307,,,,Fellow of the Faculty of Public Health.,Other
9717,,Membership of the British Medical Association.,03/08/2024,04/08/2024,,Miscellaneous,Dr Beccy Cooper,5307,,,,Membership of the British Medical Association.,Other
9696,,"Unpaid directorship, Sterling Montague Ltd.",03/08/2024,04/08/2024,,Miscellaneous,Alison Griffiths,5203,,,,"Unpaid directorship, Sterling Montague Ltd.",Financial interest or material benefit
9694,,"Unpaid directorship
Strategic Risk Control Ltd.",03/08/2024,04/08/2024,,Miscellaneous,Alison Griffiths,5203,,,,"Unpaid directorship
Strategic Risk Control Ltd.",Financial interest or material benefit
9617,,Membership of the legal profession as a solicitor.,02/08/2024,04/08/2024,,Miscellaneous,Lucy Rigby,5333,,,,Membership of the legal profession as a solicitor.,Other
9530,,"Fellow at the Center for Advanced Security, Strategic and Integration Studies (CASSIS) at the University of Bonn. This is an unpaid role.",02/08/2024,04/08/2024,,Miscellaneous,Stephen Gethins,4434,,,,"Fellow at the Center for Advanced Security, Strategic and Integration Studies (CASSIS) at the University of Bonn. This is an unpaid role.",Unpaid role
9526,,Director of Blebo Global Ltd.,02/08/2024,04/08/2024,,Miscellaneous,Stephen Gethins,4434,,,None,Director of Blebo Global Ltd.,Financial interest or material benefit
9522,,Chair of the Labour Friends of Kosovo group,02/08/2024,04/08/2024,,Miscellaneous,Mrs Emma Lewell-Buck,4277,23/07/2024,,,Chair of the Labour Friends of Kosovo group,Unpaid role
9516,,"Unpaid Board Member, Sea Change Cafe, South Shields (Sea Change Cafe is a Community Interest Company)",02/08/2024,04/08/2024,,Miscellaneous,Mrs Emma Lewell-Buck,4277,23/03/2023,,,"Unpaid Board Member, Sea Change Cafe, South Shields (Sea Change Cafe is a Community Interest Company)",Unpaid role
9489,,Chair of Splash Group. This is an unpaid role.,02/08/2024,04/08/2024,,Miscellaneous,Irene Campbell,5145,,,,Chair of Splash Group. This is an unpaid role.,Unpaid role
9464,,Registered with the Gambling Commission as one of the responsible persons on two society licenses issued to the Labour Party. This is an unpaid role.,02/08/2024,04/08/2024,,Miscellaneous,Mr Alex Barros-Curtis,5175,,,,Registered with the Gambling Commission as one of the responsible persons on two society licenses issued to the Labour Party. This is an unpaid role.,Unpaid role
9418,,"Chair of Governors, Grafton Primary School, London. This is an unpaid role.",02/08/2024,04/08/2024,,Miscellaneous,Mr Alex Barros-Curtis,5175,,,,"Chair of Governors, Grafton Primary School, London. This is an unpaid role.",Unpaid role
9154,,Co-Leader of the Green Party (England and Wales). This is a non-executive part-time role.,03/08/2024,04/08/2024,,Miscellaneous,Adrian Ramsay,5320,,,,Co-Leader of the Green Party (England and Wales). This is a non-executive part-time role.,Formal role with a party organisation
9217,,Unpaid director for the local community-run post office.,02/08/2024,04/08/2024,,Miscellaneous,Elaine Stewart,5206,,,,Unpaid director for the local community-run post office.,Unpaid role
9194,,"Trustee, Museum of Policing in Cheshire. This is an unpaid role.",02/08/2024,04/08/2024,,Miscellaneous,Sarah Hall,5154,,,,"Trustee, Museum of Policing in Cheshire. This is an unpaid role.",Unpaid role
9216,,Director of Dalmellington Parish Development trust. This is an unpaid role.,02/08/2024,04/08/2024,,Miscellaneous,Elaine Stewart,5206,,,,Director of Dalmellington Parish Development trust. This is an unpaid role.,Unpaid role
9129,,Member of the Local Community Liaison Committee run by EDF Energy as a result of being the Councillor for Sturton Ward in Bassetlaw. This is an unpaid role.,02/08/2024,04/08/2024,,Miscellaneous,James Naish,5047,,,,Member of the Local Community Liaison Committee run by EDF Energy as a result of being the Councillor for Sturton Ward in Bassetlaw. This is an unpaid role.,Unpaid role
9128,,Non-continuous board member of the Trent Valley Internal Drainage Board as a result of being a Bassetlaw District Councillor. This is an unpaid role.,02/08/2024,04/08/2024,,Miscellaneous,James Naish,5047,,01/08/2024,,Non-continuous board member of the Trent Valley Internal Drainage Board as a result of being a Bassetlaw District Councillor. This is an unpaid role.,Unpaid role
9124,,Member of the Bassetlaw Shared Prosperity Partnership Group as a result of being the Leader of Bassetlaw District Council. This is an unpaid role.,02/08/2024,04/08/2024,,Miscellaneous,James Naish,5047,,25/07/2024,,Member of the Bassetlaw Shared Prosperity Partnership Group as a result of being the Leader of Bassetlaw District Council. This is an unpaid role.,Unpaid role
9122,,Member of The City of Nottingham and Nottinghamshire Economic Prosperity Committee as a result of being the Leader of Bassetlaw District Council. This is an unpaid role.,02/08/2024,04/08/2024,,Miscellaneous,James Naish,5047,,25/07/2024,,Member of The City of Nottingham and Nottinghamshire Economic Prosperity Committee as a result of being the Leader of Bassetlaw District Council. This is an unpaid role.,Unpaid role
9119,,Non-voting member of the South Yorkshire Mayoral Combined Authority as a result of being the Leader of Bassetlaw District Council. This is an unpaid role.,02/08/2024,04/08/2024,,Miscellaneous,James Naish,5047,,25/07/2024,,Non-voting member of the South Yorkshire Mayoral Combined Authority as a result of being the Leader of Bassetlaw District Council. This is an unpaid role.,Unpaid role
9118,,Deputy / Shadow Cabinet Member of the East Midlands Combined County Authority as a result of being the Leader of Bassetlaw District Council. This is an unpaid role.,02/08/2024,04/08/2024,,Miscellaneous,James Naish,5047,,25/07/2024,,Deputy / Shadow Cabinet Member of the East Midlands Combined County Authority as a result of being the Leader of Bassetlaw District Council. This is an unpaid role.,Unpaid role
9110,,Member of the Midlands Nuclear Board as a result of being the Leader of Bassetlaw District Council. This is an unpaid role.,02/08/2024,04/08/2024,,Miscellaneous,James Naish,5047,,25/07/2024,,Member of the Midlands Nuclear Board as a result of being the Leader of Bassetlaw District Council. This is an unpaid role.,Unpaid role
9105,,Member of the District Councils' Network as a result of being the Leader of Bassetlaw District Council. This is an unpaid role.,02/08/2024,04/08/2024,,Miscellaneous,James Naish,5047,,25/07/2024,,Member of the District Councils' Network as a result of being the Leader of Bassetlaw District Council. This is an unpaid role.,Unpaid role
8943,,"The Good Law Project is in receipt of donations (including crowdfunded donations) to support legal costs in one legal action in which I am named as a party. The legal proceedings do not concern my personal rights or liabilities, and I do not personally receive any donations.",03/08/2024,04/08/2024,,Miscellaneous,Siân Berry,5314,,,,"The Good Law Project is in receipt of donations (including crowdfunded donations) to support legal costs in one legal action in which I am named as a party. The legal proceedings do not concern my personal rights or liabilities, and I do not personally receive any donations.",Fund to defray legal costs
9065,,I am currently on an unpaid career break from my position as Chair of Urban Water Management at Heriot-Watt University.,02/08/2024,04/08/2024,,Miscellaneous,Dr Scott Arthur,5212,01/08/2024,05/07/2029,Heriot-Watt University,I am currently on an unpaid career break from my position as Chair of Urban Water Management at Heriot-Watt University.,Unpaid role
9023,,Unpaid role sitting on the board of Water and Sanitation for the Urban Poor (WSUP) which seeks to alleviate poverty and suffering in the world through the extension of water and sanitation services to low income communities.,01/08/2024,04/08/2024,,Miscellaneous,Helena Dollimore,5192,,05/07/2024,,Unpaid role sitting on the board of Water and Sanitation for the Urban Poor (WSUP) which seeks to alleviate poverty and suffering in the world through the extension of water and sanitation services to low income communities.,Unpaid role
8862,,Vice-chair of the Jewish Labour Movement. This is an unpaid role.,01/08/2024,04/08/2024,,Miscellaneous,Sarah Sackman,5204,,,,Vice-chair of the Jewish Labour Movement. This is an unpaid role.,Formal role with a party organisation
9075,,Thatcham Town Councillor. This is an unpaid role.,01/08/2024,04/08/2024,,Miscellaneous,Mr Lee Dillon,5310,,,,Thatcham Town Councillor. This is an unpaid role.,Unpaid role
8585,,Chartered Town Planner Member of the Royal Town Planning Institute. This is an unpaid role.,31/07/2024,04/08/2024,,Miscellaneous,Mr Gideon Amos,5250,,,,Chartered Town Planner Member of the Royal Town Planning Institute. This is an unpaid role.,Unpaid role
8846,,Elected Member Glasgow City Council. This is an unpaid role.,01/08/2024,04/08/2024,,Miscellaneous,Maureen Burke,5137,,,,Elected Member Glasgow City Council. This is an unpaid role.,Unpaid role
8617,,"Company director, Saibick Investments Ltd.",31/07/2024,04/08/2024,,Miscellaneous,Aphra Brandreth,5241,,,,"Company director, Saibick Investments Ltd.",Other
8621,,Chair of West London Waste Authority. This is an unpaid role.,01/08/2024,04/08/2024,,Miscellaneous,Deirdre Costigan,5075,,31/07/2024,,Chair of West London Waste Authority. This is an unpaid role.,Unpaid role
8697,,Co-opted Governor for Elysium Training. This is an unpaid role.,31/07/2024,04/08/2024,,Miscellaneous,Jo Platt,4673,,,,Co-opted Governor for Elysium Training. This is an unpaid role.,Unpaid role
8329,,"Non Executive Board Member, Larger Us. This is an unpaid role.",01/08/2024,04/08/2024,,Miscellaneous,Kirsty McNeill,5114,,11/07/2024,,"Non Executive Board Member, Larger Us. This is an unpaid role.",Unpaid role
8330,,"Non Executive Board Member, Labour Climate and Environment Forum (LCEF). This is an unpaid role.",01/08/2024,04/08/2024,,Miscellaneous,Kirsty McNeill,5114,,11/07/2024,,"Non Executive Board Member, Labour Climate and Environment Forum (LCEF). This is an unpaid role.",Unpaid role
8706,,"Director of Pride In Leigh CIC, an organisation that hosts Pride events in Leigh. This is an unpaid role.",31/07/2024,04/08/2024,,Miscellaneous,Jo Platt,4673,,,,"Director of Pride In Leigh CIC, an organisation that hosts Pride events in Leigh. This is an unpaid role.",Unpaid role
8343,,Trustee of Bishop Auckland Community Partnership (Four Clocks Centre). This is an unpaid role.,30/07/2024,04/08/2024,,Miscellaneous,Sam Rushworth,5108,,,,Trustee of Bishop Auckland Community Partnership (Four Clocks Centre). This is an unpaid role.,Unpaid role
8711,,"Treasurer, Leedstown Cricket Club. This is an unpaid role.",04/08/2024,04/08/2024,,Miscellaneous,Andrew George,227,,,,"Treasurer, Leedstown Cricket Club. This is an unpaid role.",Unpaid role
8417,,Chair of Stop Uyghur Genocide Charity. This is an unpaid role.,31/07/2024,04/08/2024,,Miscellaneous,Blair McDougall,5076,,,,Chair of Stop Uyghur Genocide Charity. This is an unpaid role.,Unpaid role
8418,,Unpaid Director of Uyghur Campaign Ltd.,31/07/2024,04/08/2024,,Miscellaneous,Blair McDougall,5076,,,,Unpaid Director of Uyghur Campaign Ltd.,Unpaid role
8464,,School governor. This is an unpaid role.,31/07/2024,04/08/2024,,Miscellaneous,Mrs Sarah Russell,5324,,12/07/2024,,School governor. This is an unpaid role.,Unpaid role
8491,,"Board member and trustee, Flourishing Faifley charity. This is an unpaid role.",31/07/2024,04/08/2024,,Miscellaneous,Douglas McAllister,5057,,,,"Board member and trustee, Flourishing Faifley charity. This is an unpaid role.",Unpaid role
8799,,"Director, 30th State Productions Limited",01/08/2024,04/08/2024,,Miscellaneous,Alan Gemmell,5185,,,,"Director, 30th State Productions Limited",Other
8488,,Non practising Solicitor (qualified in Scotland).,31/07/2024,04/08/2024,,Miscellaneous,Douglas McAllister,5057,,,,Non practising Solicitor (qualified in Scotland).,Unpaid role
8131,,"In my role as the Metro Mayor of the West of England I am a chair/member of the following committees and boards:
West of England Mayoral Combined Authority Committee; Temple Quarter Strategic Board; West of England LEP Board; Regional Capital Board; West of England Mayoral Combined Authority Joint Skills and Business Boards, Joint Transport, Housing & Planning Boards, and the Climate & Nature Action Panel.",30/07/2024,04/08/2024,,Miscellaneous,Dan Norris,221,,,,"In my role as the Metro Mayor of the West of England I am a chair/member of the following committees and boards:
West of England Mayoral Combined Authority Committee; Temple Quarter Strategic Board; West of England LEP Board; Regional Capital Board; West of England Mayoral Combined Authority Joint Skills and Business Boards, Joint Transport, Housing & Planning Boards, and the Climate & Nature Action Panel.",Unpaid role
8153,,Chairperson of the Farmers Union of Wales - Carmarthenshire branch. This is an unpaid role.,30/07/2024,04/08/2024,,Miscellaneous,Ann Davies,5177,,,,Chairperson of the Farmers Union of Wales - Carmarthenshire branch. This is an unpaid role.,Unpaid role
1811,,Barrister (non-practising).,,04/08/2024,,Miscellaneous,Mr David Lammy,206,,,,Barrister (non-practising).,Other
1570,,Unpaid director of Brockthorpe Consultancy Ltd; consultants and rural surveyors. This is the umbrella company of Brockthorpe Consultancy RM.,09/01/2020,04/08/2024,03/08/2024,Miscellaneous,Robbie Moore,4861,13/12/2019,17/11/2023,,Unpaid director of Brockthorpe Consultancy Ltd; consultants and rural surveyors. This is the umbrella company of Brockthorpe Consultancy RM.,Unpaid role
1657,,Member of the Wolverhampton Town Board. This is an unpaid role.,04/02/2020,04/08/2024,17/07/2024,Miscellaneous,Stuart Anderson,4742,,,,Member of the Wolverhampton Town Board. This is an unpaid role.,Unpaid role
1818,,"Associate Tenant, Doughty Street Chambers. This is an unpaid role.",30/09/2020,04/08/2024,,Miscellaneous,Mr David Lammy,206,01/06/2020,,,"Associate Tenant, Doughty Street Chambers. This is an unpaid role.",Unpaid role
1822,,Visiting Professor in Practice at the London School of Economics and Political Science. This is an unpaid role.,30/09/2020,04/08/2024,04/08/2024,Miscellaneous,Mr David Lammy,206,07/09/2020,,,Visiting Professor in Practice at the London School of Economics and Political Science. This is an unpaid role.,Unpaid role
1824,,"Professor of Practice at SOAS, University of London. This is an unpaid role.",09/08/2021,04/08/2024,04/08/2024,Miscellaneous,Mr David Lammy,206,28/07/2021,,,"Professor of Practice at SOAS, University of London. This is an unpaid role.",Unpaid role
1893,,"A member of the Board of Governors of the Institute for Government, a UK thinktank. This is an unpaid role.",16/03/2023,04/08/2024,01/08/2024,Miscellaneous,Dame Angela Eagle,491,16/03/2023,18/07/2024,,"A member of the Board of Governors of the Institute for Government, a UK thinktank. This is an unpaid role.",Unpaid role
2095,,Director of the Lionel Cooke Memorial Fund Ltd. This is an unpaid role.,14/03/2023,04/08/2024,01/08/2024,Miscellaneous,Wes Streeting,4504,19/01/2017,10/07/2024,,Director of the Lionel Cooke Memorial Fund Ltd. This is an unpaid role.,Unpaid role
2096,,Executive Committee member of the Fabian Society. This is an unpaid role.,14/03/2023,04/08/2024,01/08/2024,Miscellaneous,Wes Streeting,4504,16/11/2019,10/07/2024,,Executive Committee member of the Fabian Society. This is an unpaid role.,Unpaid role
3487,,"Chairman of the Conservative Party. This post carries a salary of £69,000 per annum.",16/11/2023,04/08/2024,04/08/2024,Miscellaneous,Mr Richard Holden,4813,13/11/2023,08/07/2024,,"Chairman of the Conservative Party. This post carries a salary of £69,000 per annum.",Formal role with a party organisation
3488,,A director of C&UCO Properties. This is an unpaid role that is attached to my position as Chairman of the Conservative Party.,16/11/2023,04/08/2024,04/08/2024,Miscellaneous,Mr Richard Holden,4813,13/11/2023,08/07/2024,,A director of C&UCO Properties. This is an unpaid role that is attached to my position as Chairman of the Conservative Party.,Unpaid role
3489,,A director of C&UCO Management Limited. This is an unpaid role that is attached to my position as Chairman of the Conservative Party.,16/11/2023,04/08/2024,04/08/2024,Miscellaneous,Mr Richard Holden,4813,13/11/2023,08/07/2024,,A director of C&UCO Management Limited. This is an unpaid role that is attached to my position as Chairman of the Conservative Party.,Unpaid role
3490,,A director of C&UCO Services Limited. This is an unpaid role that is attached to my position as Chairman of the Conservative Party.,16/11/2023,04/08/2024,04/08/2024,Miscellaneous,Mr Richard Holden,4813,13/11/2023,08/07/2024,,A director of C&UCO Services Limited. This is an unpaid role that is attached to my position as Chairman of the Conservative Party.,Unpaid role
5655,,Member of the House Magazine Advisory Board. This is an unpaid role.,08/05/2024,04/08/2024,02/08/2024,Miscellaneous,Dame Meg Hillier,1524,17/03/2021,30/05/2024,,Member of the House Magazine Advisory Board. This is an unpaid role.,Unpaid role
6665,,"Trustee of Braehead, Broomridge and District Community Development Trust. This is an unpaid role.",29/07/2024,04/08/2024,,Miscellaneous,Chris Kane,5155,,,,"Trustee of Braehead, Broomridge and District Community Development Trust. This is an unpaid role.",Unpaid role
6667,,Director of Stirling Technology Projects Ltd. This is an unpaid role.,29/07/2024,04/08/2024,,Miscellaneous,Chris Kane,5155,,,,Director of Stirling Technology Projects Ltd. This is an unpaid role.,Unpaid role
7182,,"Elected Councillor, Watford Borough Council. This is an unpaid role.",30/07/2024,04/08/2024,,Miscellaneous,Matt Turmaine,5130,,,,"Elected Councillor, Watford Borough Council. This is an unpaid role.",Unpaid role
8164,,Chair Governance and Scrutiny Committee. This is an unpaid role.,04/08/2024,04/08/2024,,Miscellaneous,Lillian Jones,5043,,,,Chair Governance and Scrutiny Committee. This is an unpaid role.,Unpaid role
8192,,"School governor for Grange Primary School, Ealing. This is an unpaid role.",30/07/2024,04/08/2024,,Miscellaneous,Peter Swallow,5165,,05/07/2024,,"School governor for Grange Primary School, Ealing. This is an unpaid role.",Unpaid role
8226,,"School Governor, Kingsford School, Beckton, Newham. This is an unpaid role.",30/07/2024,04/08/2024,,Miscellaneous,James Asser,5211,,,,"School Governor, Kingsford School, Beckton, Newham. This is an unpaid role.",Unpaid role
8227,,"Trustee of the registered charity, Drug Science. This is an unpaid role.",30/07/2024,04/08/2024,,Miscellaneous,Jeff Smith,4456,,,,"Trustee of the registered charity, Drug Science. This is an unpaid role.",Unpaid role
8250,,"Unpaid Director, Community Conversations Ltd.",30/07/2024,04/08/2024,,Miscellaneous,Daniel Francis,5184,,,,"Unpaid Director, Community Conversations Ltd.",Financial interest or material benefit
8257,,Councillor on Hertford Town Council. This is an unpaid role.,30/07/2024,04/08/2024,,Miscellaneous,Josh Dean,5187,,08/07/2024,,Councillor on Hertford Town Council. This is an unpaid role.,Unpaid role
8325,,Chair of the Advisory Board - Our Scottish Future (OSF). This is an unpaid role.,01/08/2024,04/08/2024,,Miscellaneous,Kirsty McNeill,5114,,11/07/2024,,Chair of the Advisory Board - Our Scottish Future (OSF). This is an unpaid role.,Unpaid role
6595,,"Unpaid director of [redacted] Management Company, a property management company.",30/07/2024,04/08/2024,,Miscellaneous,Tom Rutland,5222,,,,"Unpaid director of [redacted] Management Company, a property management company.",Unpaid role
