ID,Summary,Parent Interest ID,Registered,Published,Updated_1,Category,MNIS ID,Member,JobTitle,StartDate,EndDate,IsUntilFurtherNotice,PayerName,PayerIsPrivateIndividual,IsPaidAsDirectorOfPayer,PayerNatureOfBusiness,PayerPublicAddress,HasSoughtAcobaAdvice,Link,Updated_2,Updated_3,Updated_4,Updated_5,Updated_6,Updated_7
6852,Presenter - GB News Ltd,,2024-07-22,2024-07-22,,Employment and earnings,5091,Nigel Farage,Presenter,,,False,GB News Ltd,False,False,,"Riverbank House, 2 Swan Lane, London EC4R3TT",,https://interests-api.parliament.uk/api/v1/Interests/6852,,,,,,
6926,Legal services - Bower Cotton,,2024-07-22,2024-07-22,,Employment and earnings,1508,Sir Geoffrey Cox,Legal services,2024-04-22,2024-05-23,True,Bower Cotton,False,False,Solicitors,"34 Ely Place, Holborn, London EC1N 6TD",,https://interests-api.parliament.uk/api/v1/Interests/6926,,,,,,
6318,Writing a book - RCW Literary Agency,,2024-07-16,2024-07-18,,Employment and earnings,5267,Yuan Yang,Writing a book,2024-07-11,,False,RCW Literary Agency,False,False,Literary agency,"20 Powis Mews, London W11 1JN",,https://interests-api.parliament.uk/api/v1/Interests/6318,,,,,,
6653,Non Executive Director - Quidnet REIT Ltd,,2024-07-18,2024-07-18,,Employment and earnings,5161,Richard Tice,Non Executive Director,,,False,Quidnet REIT Ltd,False,True,Property Investment,24 Berkeley Square,,https://interests-api.parliament.uk/api/v1/Interests/6653,,,,,,
6053,Councillor - Birmingham City Council,,2024-07-10,2024-07-17,,Employment and earnings,5357,Ayoub Khan,Councillor,,,False,Birmingham City Council,False,False,,"Council House, Victoria Square, Birmingham B1 1BB",,https://interests-api.parliament.uk/api/v1/Interests/6053,,,,,,
6545,Locum Doctor - NHS,,2024-07-17,2024-07-17,2025-05-12,Employment and earnings,5030,Dr Simon Opher,Locum Doctor,,,False,NHS,False,False,,"May Lane Surgery, Dursley, Glos GL11 4JN",,https://interests-api.parliament.uk/api/v1/Interests/6545,,,,,,
6240,Physiotherapist - Dudley Group NHS Foundation Trust,,2024-07-15,2024-07-17,,Employment and earnings,5274,Sonia Kumar,Physiotherapist,,,False,Dudley Group NHS Foundation Trust,False,False,,"Russells Hall Hospital, Pensnett Road, Dudley DY1 2HQ",,https://interests-api.parliament.uk/api/v1/Interests/6240,,,,,,
6454,Councillor - Woking Borough Council,,2024-07-16,2024-07-16,2025-05-30,Employment and earnings,5322,Mr Will Forster,Councillor,,2025-05-29,True,Woking Borough Council,False,False,,"Civic Offices, Gloucester Square, Woking GU21 6YL",,https://interests-api.parliament.uk/api/v1/Interests/6454,,,,,,
6354,Local Councillor - RBWM - Royal Borough of Windsor & Maidenhead,,2024-07-16,2024-07-16,,Employment and earnings,5343,Mr Joshua Reynolds,Local Councillor - RBWM,,,False,Royal Borough of Windsor & Maidenhead,False,False,Local Council,"Town Hall, St Ives Road, Maidenhead SL6 1RF",,https://interests-api.parliament.uk/api/v1/Interests/6354,,,,,,
6352,Councillor - Surrey County Council,,2024-07-16,2024-07-16,2025-05-30,Employment and earnings,5322,Mr Will Forster,Councillor,,2025-05-29,True,Surrey County Council,False,False,,"11 Cockshot Hill, Woodhatch, Reigate RH2 8EF",,https://interests-api.parliament.uk/api/v1/Interests/6352,,,,,,
6476,Councilor - Somerset Council,,2024-07-16,2024-07-16,,Employment and earnings,5191,Adam Dance,Councilor,,,False,Somerset Council,False,False,,"County Hall, The Crescent, Taunton TA1 4DY",,https://interests-api.parliament.uk/api/v1/Interests/6476,,,,,,
6301,County Councillor - Leicestershire County Council,,2024-07-15,2024-07-15,,Employment and earnings,5330,Mr Peter Bedford,County Councillor,,2025-05-01,True,Leicestershire County Council,False,False,Local Authority,"Leicestershire County Council, County Hall, Glenfield, Leicester LE3 8RA",,https://interests-api.parliament.uk/api/v1/Interests/6301,,,,,,
6308,Partner in retail fashion business - Pure,,2024-07-15,2024-07-15,,Employment and earnings,5049,Michelle Scrogham,Partner in retail fashion business,,,False,Pure,True,True,Retail fashion,,,https://interests-api.parliament.uk/api/v1/Interests/6308,,,,,,
6253,Councillor - Hertfordshire County Council,,2024-07-15,2024-07-15,2025-05-06,Employment and earnings,5050,Lewis Cocking,Councillor,2021-05-06,2025-05-06,True,Hertfordshire County Council,False,False,,"County Hall, Pegs Lane, Hertford SG13 8DQ",,https://interests-api.parliament.uk/api/v1/Interests/6253,,,,,,
5988,Barrister - Doughty Street Chambers,,2024-07-10,2024-07-12,,Employment and earnings,5067,Tony Vaughan,Barrister,,,False,Doughty Street Chambers,False,False,Legal services,"54 Doughty Street, London WC1N 2LS",,https://interests-api.parliament.uk/api/v1/Interests/5988,,,,,,
6127,Councillor - BCP Council,,2024-07-11,2024-07-11,,Employment and earnings,5327,Vikki Slade,Councillor,2024-07-05,,False,BCP Council,False,False,Local Authority,"Civic Centre, Bourne Avenue, Bournemouth BH2 6DY",,https://interests-api.parliament.uk/api/v1/Interests/6127,,,,,,
6087,Member of the Appeals Committee for the Human Fertilisation and Embryology Authority - Human Fertilisation and Embryology Authority,,2024-07-11,2024-07-11,,Employment and earnings,5197,Dr Neil Shastri-Hurst,Member of the Appeals Committee for the Human Fertilisation and Embryology Authority,,,False,Human Fertilisation and Embryology Authority,False,False,,"2nd Floor, 2 Redman Place, London E20 1JQ",,https://interests-api.parliament.uk/api/v1/Interests/6087,,,,,,
6052,"Director & Employee, Barrister - Chambers of Ayoub Khan Ltd",,2024-07-10,2024-07-10,,Employment and earnings,5357,Ayoub Khan,"Director & Employee, Barrister",2024-07-04,,False,Chambers of Ayoub Khan Ltd,True,True,Barrister,,,https://interests-api.parliament.uk/api/v1/Interests/6052,,,,,,
6031,Barrister - No5 Chambers,,2024-07-10,2024-07-10,,Employment and earnings,5197,Dr Neil Shastri-Hurst,Barrister,,,False,No5 Chambers,False,False,,"103 Colmore Row, Birmingham B3 3AG",,https://interests-api.parliament.uk/api/v1/Interests/6031,,,,,,
3871,Writing and adapting a book - United Agents,,,2024-07-08,2024-07-08,Employment and earnings,1446,Chris Bryant,Writing and adapting a book,,,False,United Agents,False,False,,"12-26 Lexington Street, London W1F 0LE",,https://interests-api.parliament.uk/api/v1/Interests/3871,,,,,,
5774,Appearances on ITV programmes - ITV PLC,,,2024-05-16,,Employment and earnings,4573,Dr Rosena Allin-Khan,Appearances on ITV programmes,,,False,ITV PLC,False,False,,"ITV White City, 201 Wood Lane, London W12 7RU",,https://interests-api.parliament.uk/api/v1/Interests/5774,,,,,,
5729,Legal services - CGS Solicitors,,,2024-05-13,,Employment and earnings,1508,Sir Geoffrey Cox,Legal services,,,False,CGS Solicitors,False,False,,"4th Floor, 1 Minster Court, Mincing Lane, London EC3R 7AA",,https://interests-api.parliament.uk/api/v1/Interests/5729,,,,,,
5727,Legal services - Bortoft Bell Solicitors,,,2024-05-13,,Employment and earnings,1508,Sir Geoffrey Cox,Legal services,,,False,Bortoft Bell Solicitors,False,False,,"2 John Street, London WC1N 2ES",,https://interests-api.parliament.uk/api/v1/Interests/5727,,,,,,
5638,Speaker - Chartwell Speakers,,2024-05-07,2024-05-09,,Employment and earnings,4020,George Freeman,Speaker,2024-04-22,,False,Chartwell Speakers,False,False,speaker bureau and literary agency,"WeWork, Colonnade Walk, 123 Buckingham Palace Road, London SW1W 9SH",True,https://interests-api.parliament.uk/api/v1/Interests/5638,,,,,,
5320,Royalties for a book - David Luxton,,,2024-04-19,,Employment and earnings,4040,Chris Evans,Royalties for a book,,,False,David Luxton,False,False,Literary Agent,"First Floor, Jebsen House, 53-61 High Street, Ruislip, Middlesex, England, HA4 7BD",,https://interests-api.parliament.uk/api/v1/Interests/5320,,,,,,
4482,Library copyright fees - Public Lending Right,,,2024-04-18,,Employment and earnings,4370,Jess Phillips,Library copyright fees,,,False,Public Lending Right,False,False,,"British Library, Boston Spa, Wetherby LS23 7BQ",,https://interests-api.parliament.uk/api/v1/Interests/4482,,,,,,
5282,Practice at the Bar of England and Wales - Thomas More Chambers,,,2024-04-14,2023-08-02,Employment and earnings,1508,Sir Geoffrey Cox,Practice at the Bar of England and Wales,,,False,Thomas More Chambers,False,False,,"7 Lincoln's Inn Fields, London WC2A 3BP",,https://interests-api.parliament.uk/api/v1/Interests/5282,2024-04-12,,,,,
5142,Legal Services - Director of Public Prosecutions Mauritius,,,2024-04-09,,Employment and earnings,1508,Sir Geoffrey Cox,Legal Services,2023-09-01,2024-02-29,True,Director of Public Prosecutions Mauritius,False,False,,"Level 10, 16 Garden Tower Building, Poudriere St, Port Louis, Mauritius",,https://interests-api.parliament.uk/api/v1/Interests/5142,,,,,,
4480,Royalties,,,2024-03-26,,Employment and earnings,4370,Jess Phillips,Royalties,,,False,Authors' Licensing and Collecting Society (ALCS),False,False,Collection of copyright payments for authors,"6th Floor, International House, 1 St Katharine's Way, London E1W 1UN",False,https://interests-api.parliament.uk/api/v1/Interests/4480,,,,,,
4855,Part-time professor in Political Studies - University of Greater Manchester,,,2024-03-18,2025-02-13,Employment and earnings,350,Sir John Hayes,Part-time professor in Political Studies,2020-04-01,2025-07-11,True,University of Greater Manchester,False,False,,"Deane Road, Bolton BL3 5AB",,https://interests-api.parliament.uk/api/v1/Interests/4855,2025-07-14,,,,,
4865,Consultant paediatrician - North West Anglia NHS Foundation Trust,,2017-01-09,2024-03-18,2017-04-27,Employment and earnings,4592,Dr Caroline Johnson,Consultant paediatrician,,,False,North West Anglia NHS Foundation Trust,False,False,,"Peterborough City Hospital, Bretton Gate, Bretton PE3 9GZ",,https://interests-api.parliament.uk/api/v1/Interests/4865,2017-07-06,2020-03-13,2021-11-16,2022-06-21,2022-10-07,2023-10-26
4136,Writing a book - Head of Zeus – UK,,,2024-03-18,,Employment and earnings,1171,Liam Byrne,Writing a book,,,False,Head of Zeus – UK,False,False,,"5-8 Hardwick Street, London EC1R 4RG",,https://interests-api.parliament.uk/api/v1/Interests/4136,,,,,,
5019,EMI - Royalty payments - EMI,,2015-05-01,2024-03-18,,Employment and earnings,1440,Pete Wishart,EMI - Royalty payments,,,False,EMI,False,False,,"EMI House, 43 Brook Green, London W6 7EF",,https://interests-api.parliament.uk/api/v1/Interests/5019,,,,,,
4836,Independent Non-executive Director - Super Sharp Space Systems,,,2024-03-18,,Employment and earnings,4074,Mark Garnier,Independent Non-executive Director,2023-09-01,,False,Super Sharp Space Systems,False,False,Low orbit Earth observation telescopes,"G0 Stirling House, Cambridge Innovation Park, Denney End Road, Waterbeach CB25 9PB",,https://interests-api.parliament.uk/api/v1/Interests/4836,,,,,,
3818,Member of the Advisory Board of the House Magazine - Political Engagement Limited,,2021-07-01,2024-03-18,2022-12-09,Employment and earnings,4110,Dame Karen Bradley,Member of the Advisory Board of the House Magazine,2021-05-12,,False,Political Engagement Limited,False,False,,"11th Floor, Millbank Tower, 21-24 Millbank, London SW1P 4QP",True,https://interests-api.parliament.uk/api/v1/Interests/3818,2023-10-19,,,,,
4251,Royalties on a textbook,,,2024-03-18,,Employment and earnings,4657,Anneliese Dodds,Royalties on a textbook,,,False,Bloomsbury Publishers Plc,False,False,,"50 Bedford Square, London WC1B 3DP",,https://interests-api.parliament.uk/api/v1/Interests/4251,,,,,,
4308,Writing articles - Reach Group Limited,,,2024-03-18,2024-11-29,Employment and earnings,4084,Esther McVey,Writing articles,,,False,Reach Group Limited,False,False,,"21st Floor, One Canada Square, Canary Wharf, London E14 5AP",True,https://interests-api.parliament.uk/api/v1/Interests/4308,,,,,,
4169,Writing a book - Conville and Walsh,,,2024-03-18,,Employment and earnings,420,Yvette Cooper,Writing a book,,,False,Conville and Walsh,False,False,literary agent,"Haymarket House, London SW1Y 4SP",,https://interests-api.parliament.uk/api/v1/Interests/4169,,,,,,
4286,Writing an article,,,2024-03-18,,Employment and earnings,4500,Clive Lewis,Writing an article,,,False,Guardian News & Media Limited,False,False,,"PO Box 68164, Kings Place, 90 York Way, London N1P 2AP",,https://interests-api.parliament.uk/api/v1/Interests/4286,,,,,,
4935,Copyright payments for books written before my election to Parliament - Authors’ Licensing and Collecting Society,,,2024-03-18,,Employment and earnings,4514,Sir Keir Starmer,Copyright payments for books written before my election to Parliament,,,False,Authors’ Licensing and Collecting Society,False,False,,"4 Battle Bridge Lane, London SE1 2HX",,https://interests-api.parliament.uk/api/v1/Interests/4935,,,,,,
4707,Partner - East Beckham partnership,,2015-05-01,2024-03-18,,Employment and earnings,249,Sir Geoffrey Clifton-Brown,Partner,,,False,East Beckham partnership,False,False,Arable farming,Norfolk,,https://interests-api.parliament.uk/api/v1/Interests/4707,,,,,,
4970,Marketing advisory services - ATS Group,,,2024-03-18,2024-11-19,Employment and earnings,1576,Mark Pritchard,Marketing advisory services,2023-11-01,2024-10-24,True,ATS Group,False,False,an industrial manufacturing and technology business,"1550, No. 17 Industrial Zone Vizbegovo, Skopje, North Macedonia",,https://interests-api.parliament.uk/api/v1/Interests/4970,,,,,,
4961,Strategic marketing counsel - Strategeast,,,2024-03-18,2025-02-03,Employment and earnings,1576,Mark Pritchard,Strategic marketing counsel,2022-04-01,2024-05-03,True,Strategeast,False,False,a non-profit organisation which promotes the rule of law in Eurasian countries through the digital economy and a client of MAP Advisory Ltd,"1900K Street NW, Suite 100, Washington DC 20006, USA",,https://interests-api.parliament.uk/api/v1/Interests/4961,,,,,,
4791,Writing articles in Diplomat Magazine - Aros Corporation Ltd,,,2024-03-18,2024-04-30,Employment and earnings,40,Sir Bernard Jenkin,Writing articles in Diplomat Magazine,,,False,Aros Corporation Ltd,True,False,,,,https://interests-api.parliament.uk/api/v1/Interests/4791,,,,,,
4335,Writing a book,,,2024-03-18,,Employment and earnings,1211,Sir Andrew Mitchell,Writing a book,,,False,AM Heath & Co Ltd,False,False,,"5 Warwick Court, London WC1R 5DJ",,https://interests-api.parliament.uk/api/v1/Interests/4335,,,,,,
4940,Legal services provided before my election to Parliament,,,2024-03-18,,Employment and earnings,4514,Sir Keir Starmer,Legal services provided before my election to Parliament,,,False,Birnberg Pierce,False,False,,"14 Inverness Street, London NW1 7HJ",,https://interests-api.parliament.uk/api/v1/Interests/4940,,,,,,
4833,Chair of the Advisory Board,,,2024-03-18,,Employment and earnings,4074,Mark Garnier,Chair of the Advisory Board,,,False,Shetland Space Centre,False,False,,"Moray Park, Seaford Avenue, Grantown-on-Spey PH26 3J",,https://interests-api.parliament.uk/api/v1/Interests/4833,,,,,,
4965,Marketing advice - Redway AG,,,2024-03-18,,Employment and earnings,1576,Mark Pritchard,Marketing advice,,,False,Redway AG,False,False,an engineering and technical services company and a client of MAP Advisory Ltd,"Oberer Graben 4-6, 9001, St Gallen, Switzerland",,https://interests-api.parliament.uk/api/v1/Interests/4965,,,,,,
4923,Non-executive Director - CSA Catapult Innovation Centre,,2022-12-19,2024-03-18,2023-04-12,Employment and earnings,4656,Layla Moran,Non-executive Director,2022-12-01,2025-12-01,True,CSA Catapult Innovation Centre,False,True,a centre established to help the UK become a global leader in compound semiconductors,"Imperial Park Innovation Centre, Celtic Way, Newport NP10 8BE",,https://interests-api.parliament.uk/api/v1/Interests/4923,2023-06-30,2024-08-02,,,,
4181,Legal services,,,2024-03-18,,Employment and earnings,1508,Sir Geoffrey Cox,Legal services,,,False,CMS Holborn Asia,False,False,,"Holborn Law LLC, 7 Straights View, Marina One East Tower, #19-01, 018936, Singapore",,https://interests-api.parliament.uk/api/v1/Interests/4181,,,,,,
4375,Writing articles,,,2024-03-18,,Employment and earnings,4370,Jess Phillips,Writing articles,,,False,Guardian News & Media Ltd,False,False,,"Kings Place, 90 York Way, London N1P 2AP",,https://interests-api.parliament.uk/api/v1/Interests/4375,,,,,,
4932,Academic Work - Liberty Fund Inc,,,2024-03-18,,Employment and earnings,3991,Jesse Norman,Academic Work,,,False,Liberty Fund Inc,False,False,private educational foundation,"11301 N. Meridian Street, Carmel, IN 46032-4564, USA",,https://interests-api.parliament.uk/api/v1/Interests/4932,,,,,,
4849,Strategic Adviser - BB Energy Trading Ltd,,,2024-03-18,,Employment and earnings,350,Sir John Hayes,Strategic Adviser,2018-09-01,,False,BB Energy Trading Ltd,False,False,an international energy company trading worldwide,"12-14 Ansdell St, London W8 5BN",True,https://interests-api.parliament.uk/api/v1/Interests/4849,,,,,,
4353,Writing Books - Peters Fraser & Dunlop Ltd,,,2024-03-18,,Employment and earnings,3991,Jesse Norman,Writing Books,,,False,Peters Fraser & Dunlop Ltd,False,False,Book Publisher,"55 New Oxford Street, London WC1A 1BS",,https://interests-api.parliament.uk/api/v1/Interests/4353,,,,,,
4321,Panelist on TV programme - GB News,,,2024-03-18,2025-01-24,Employment and earnings,4084,Esther McVey,Panelist on TV programme,2025-01-14,,False,GB News,False,False,,"Riverbank House, 2 Swan Lane, London EC4R 3TT",True,https://interests-api.parliament.uk/api/v1/Interests/4321,,,,,,
4424,Writing a book - Peters Fraser & Dunlop Limited,,,2024-03-18,,Employment and earnings,4031,Rachel Reeves,Writing a book,,,False,Peters Fraser & Dunlop Limited,False,False,,"55 New Oxford Street, London WC1A 1BS",,https://interests-api.parliament.uk/api/v1/Interests/4424,,,,,,
5017,Adviser,,,2024-03-18,,Employment and earnings,4108,Sir Gavin Williamson,Adviser,2023-02-21,,False,RTC Education Ltd,False,False,A provider of undergraduate and postgraduate education programmes to UK and international students.,"153 Great Titchfield Street, London W1W 5BD",True,https://interests-api.parliament.uk/api/v1/Interests/5017,,,,,,
4963,"Lead Marketing Counsel and Vice Chairman of the Advisory Board - Linden Energy Holdings, Inc",,,2024-03-18,,Employment and earnings,1576,Mark Pritchard,Lead Marketing Counsel and Vice Chairman of the Advisory Board,,,False,"Linden Energy Holdings, Inc",False,False,an energy development company and a client of MAP Advisory Ltd,"700 Milam Street, Suite 1300, Houston, Texas, 77002, USA",,https://interests-api.parliament.uk/api/v1/Interests/4963,,,,,,
4058,Chairing a training event,,,2024-03-18,,Employment and earnings,4844,Matt Vickers,Chairing a training event,,,False,International Centre for Parliamentary Studies,False,False,,"Millbank Tower, London SW1P 4QP",,https://interests-api.parliament.uk/api/v1/Interests/4058,,,,,,
4853,Columnist - Reach Plc (Reach Shared Services Ltd),,,2024-03-18,,Employment and earnings,350,Sir John Hayes,Columnist,,,False,Reach Plc (Reach Shared Services Ltd),False,False,,"5 St Pauls Square, Liverpool L3 9SJ",,https://interests-api.parliament.uk/api/v1/Interests/4853,,,,,,
4718,Independent Non-Executive Director,,2022-03-21,2024-03-18,2023-04-04,Employment and earnings,4008,Dame Caroline Dinenage,Independent Non-Executive Director,2022-03-01,,False,LNT Care Developments Group,False,False,Residential care home developer and constructor,"Helios 47, Isabella Road, Garforth LS25 2DY",True,https://interests-api.parliament.uk/api/v1/Interests/4718,,,,,,
4711,Consultant Global Counsel - Withers LLP,,2020-10-19,2024-03-18,2021-10-19,Employment and earnings,1508,Sir Geoffrey Cox,Consultant Global Counsel,2020-09-28,,False,Withers LLP,False,False,,"20 Old Bailey, London EC4M 7AN",,https://interests-api.parliament.uk/api/v1/Interests/4711,2024-01-03,,,,,
4706,Director - Carclew Limited,,,2024-03-18,2017-06-20,Employment and earnings,242,Sir Christopher Chope,Director,,,False,Carclew Limited,True,False,,,,https://interests-api.parliament.uk/api/v1/Interests/4706,,,,,,
4341,Surgeon Commander - Royal Naval Reserve,,,2024-03-18,2014-01-15,Employment and earnings,1466,Dr Andrew Murrison,Surgeon Commander,,,False,Royal Naval Reserve,False,False,,"HMS President, St Katherine’s Dock, London",,https://interests-api.parliament.uk/api/v1/Interests/4341,2015-10-02,,,,,
4249,Being a member of a grants application panel,,,2024-03-18,,Employment and earnings,4676,Marsha De Cordova,Being a member of a grants application panel,,,False,Fight for Sight,False,False,,"18 Mansell Street, London E1 8AA",,https://interests-api.parliament.uk/api/v1/Interests/4249,,,,,,
4742,Director,,,2024-03-18,,Employment and earnings,4823,John Finucane,Director,,,False,Finucane Toner Ltd,False,True,Solicitors,"76-78 Castle St, Belfast BT1 1HD",,https://interests-api.parliament.uk/api/v1/Interests/4742,,,,,,
5020,Ridge Records - Royalty payments - Ridge Records Limited,,,2024-03-18,,Employment and earnings,1440,Pete Wishart,Ridge Records - Royalty payments,,,False,Ridge Records Limited,False,True,,"1 York Street, Aberdeen AB11 5DL.",,https://interests-api.parliament.uk/api/v1/Interests/5020,,,,,,
3835,Royalties for books,,,2024-03-18,,Employment and earnings,4479,Nick Thomas-Symonds,Royalties for books,,,False,The Wylie Agency (UK) Ltd,False,False,,"17 Bedford Square, London WC1B 3JA",,https://interests-api.parliament.uk/api/v1/Interests/3835,,,,,,
4959,Director,,2013-09-07,2024-03-18,2015-07-07,Employment and earnings,1576,Mark Pritchard,Director,,,False,MAP Advisory Ltd,False,False,,"c/o Gallaghers, 2nd Floor, 69/85 Tabernacle Street, London EC2A 4RR",,https://interests-api.parliament.uk/api/v1/Interests/4959,2022-04-25,,,,,
4017,Sitting on hearings as an Independent Associate Manager - Birmingham and Solihull Mental Health Trust,,2022-03-21,2024-03-16,2023-10-05,Employment and earnings,4938,Paulette Hamilton,Sitting on hearings as an Independent Associate Manager,,,False,Birmingham and Solihull Mental Health Trust,False,False,,"Unit 1 B1, 50 Summer Hill Road, Birmingham B1 3RB",,https://interests-api.parliament.uk/api/v1/Interests/4017,2024-07-30,,,,,
4026,Preparing and delivering training and development session,,,2024-03-16,,Employment and earnings,4938,Paulette Hamilton,Preparing and delivering training and development session,,,False,King’s Fund,False,False,,"Cavendish Square, London W1G OAN",,https://interests-api.parliament.uk/api/v1/Interests/4026,,,,,,
3636,Doctor,,,2024-03-16,,Employment and earnings,4573,Dr Rosena Allin-Khan,Doctor,,,False,St George's Hospital NHS Trust,False,False,,"Blackshaw Road, London SW17 0QT",,https://interests-api.parliament.uk/api/v1/Interests/3636,,,,,,
4196,"Member of the Advisory Board of THI Holdings GmbH, Eberhardstrasse 65, 70173 Stuttgart",,,2024-03-16,,Employment and earnings,373,David Davis,"Member of the Advisory Board of THI Holdings GmbH, Eberhardstrasse 65, 70173 Stuttgart",,,False,THI Investments UK Ltd,False,False,an investment company,"17 Grosvenor Street, London W1K 4QG",True,https://interests-api.parliament.uk/api/v1/Interests/4196,,,,,,
4365,Writing books - United Agents,,,2024-03-16,,Employment and earnings,4370,Jess Phillips,Writing books,,,False,United Agents,False,False,,"Lexington House, 12-26 Lexington St, Soho, London W1F 0LE",,https://interests-api.parliament.uk/api/v1/Interests/4365,,,,,,
4033,Non-executive director,,,2024-03-16,,Employment and earnings,4739,Jerome Mayhew,Non-executive director,,,False,Walsingham Estate Management Ltd,False,False,property and land maintenance and development,"Estate Office, 10 Common Place, Walsingham, NR22 6BP",,https://interests-api.parliament.uk/api/v1/Interests/4033,,,,,,
4178,Presenter/Contributor on GB News,,,2024-03-16,,Employment and earnings,4743,Lee Anderson,Presenter/Contributor on GB News,,,False,GB News Limited,False,False,,"Riverbank House, 2 Swan Lane, London EC4R 3TT",,https://interests-api.parliament.uk/api/v1/Interests/4178,,,,,,
4138,Member of the Advisory Board of the House Magazine,,2021-09-22,2024-03-16,,Employment and earnings,1442,Mr Alistair Carmichael,Member of the Advisory Board of the House Magazine,2021-05-12,,False,Dods Group Ltd,False,False,,"11th Floor, The Shard, 32 London Bridge St, London SE1 9SG",,https://interests-api.parliament.uk/api/v1/Interests/4138,,,,,,
4217,Advisory Director - Investcorp Securities Ltd,,2020-01-09,2024-03-16,2022-07-18,Employment and earnings,3912,Richard Fuller,Advisory Director,,,False,Investcorp Securities Ltd,False,True,a venture capital company,"48 Grosvenor St, London W1K 3HW",False,https://interests-api.parliament.uk/api/v1/Interests/4217,2023-04-14,,,,,
4029,Preparing and delivering training and development sessions,,,2024-03-16,,Employment and earnings,4938,Paulette Hamilton,Preparing and delivering training and development sessions,,,False,Centaura Ltd,False,False,,"18 River Street, Lancaster LA1 1AD",,https://interests-api.parliament.uk/api/v1/Interests/4029,,,,,,
3721,Writing a book,,,2024-03-13,,Employment and earnings,1444,Mr Mark Francois,Writing a book,,,False,Kindle Direct Publishing (KDP) Amazon.com Inc,False,False,,"410 Terry Avenue, North Seattle, Washington 98109, USA",,https://interests-api.parliament.uk/api/v1/Interests/3721,,,,,,
3680,Writing articles - Daily Telegraph and Sunday Telegraph,,,2024-03-13,,Employment and earnings,152,Sir Iain Duncan Smith,Writing articles,,,False,Daily Telegraph and Sunday Telegraph,False,False,,"111 Buckingham Palace Rd, London SW1W 0DT",,https://interests-api.parliament.uk/api/v1/Interests/3680,,,,,,
3694,Writing articles - Reach Shared Services Ltd,,,2024-03-13,,Employment and earnings,152,Sir Iain Duncan Smith,Writing articles,,,False,Reach Shared Services Ltd,False,False,,"3rd Floor, 5 St Paul’s Square, Liverpool L3 9SJ",,https://interests-api.parliament.uk/api/v1/Interests/3694,,,,,,
