ID,Summary,Parent Interest ID,Registered,Published,Updated_1,Category,MNIS ID,Member,JobTitle,StartDate,EndDate,IsUntilFurtherNotice,PayerName,PayerIsPrivateIndividual,IsPaidAsDirectorOfPayer,PayerNatureOfBusiness,PayerPublicAddress,HasSoughtAcobaAdvice,Link,Updated_2,Updated_3,Updated_4,Updated_5,Updated_6,Updated_7
8141,"Professor of International Relations, School of International Relations, and Assistant Vice-Principal International, University of St Andrews - University of St Andrews",,2024-07-30,2024-08-04,2024-12-16,Employment and earnings,4434,Stephen Gethins,"Professor of International Relations, School of International Relations, and Assistant Vice-Principal International, University of St Andrews",,2024-10-31,True,University of St Andrews,False,False,University,"North Street, St Andrews",,https://interests-api.parliament.uk/api/v1/Interests/8141,,,,,,
8631,Devon County Councillor - Devon County Council,,2024-08-01,2024-08-04,2025-06-12,Employment and earnings,5138,Ian Roome,Devon County Councillor,,2025-05-01,True,Devon County Council,False,False,County Council,"Devon County Council, Topsham Road County Hall, Exeter EX2 4QD",,https://interests-api.parliament.uk/api/v1/Interests/8631,,,,,,
7074,Councillor - Isle of Wight Council,,2024-08-01,2024-08-04,,Employment and earnings,5255,Joe Robertson,Councillor,,,False,Isle of Wight Council,False,False,Local Authority,"County Hall, Newport, Isle of Wight",,https://interests-api.parliament.uk/api/v1/Interests/7074,,,,,,
7406,Screenwriter - Rochelle Stevens & Co Ltd,,2024-08-03,2024-08-04,,Employment and earnings,5254,Alison Hume,Screenwriter,,,False,Rochelle Stevens & Co Ltd,False,False,Writing Agent,"2 Terretts Place, Upper Street, London N1 1QZ",,https://interests-api.parliament.uk/api/v1/Interests/7406,,,,,,
9240,Cameo video recordings - Baron App Inc (Cameo),,2024-08-04,2024-08-04,,Employment and earnings,5091,Nigel Farage,Cameo video recordings,,,False,Baron App Inc (Cameo),False,False,,2045 W Grand Ave Suite B Chicago IL 60612,,https://interests-api.parliament.uk/api/v1/Interests/9240,,,,,,
7643,Local government councillor - London Borough of Hammersmith & Fulham,,2024-07-31,2024-08-04,,Employment and earnings,5344,Ben Coleman,Local government councillor,,,False,London Borough of Hammersmith & Fulham,False,False,London Borough Council,"Town Hall, King Street, Hammersmith, London W6 9JU",,https://interests-api.parliament.uk/api/v1/Interests/7643,,,,,,
8539,County Councillor - Kent County Council,,2024-07-31,2024-08-04,,Employment and earnings,5269,Dr Lauren Sullivan,County Councillor,2021-05-06,,False,Kent County Council,False,False,,"County Hall, Maidstone, Kent ME14 1XQ",,https://interests-api.parliament.uk/api/v1/Interests/8539,,,,,,
9483,Councillor - Somerset Council,,2024-08-04,2024-08-04,,Employment and earnings,4089,Tessa Munt,Councillor,,,False,Somerset Council,False,False,,"County Hall, Taunton, Somerset",,https://interests-api.parliament.uk/api/v1/Interests/9483,,,,,,
9835,Consultant - Clarity Legal Ltd,,2024-08-04,2024-08-04,,Employment and earnings,5231,Mr Adnan Hussain,Consultant,,,False,Clarity Legal Ltd,False,False,Rental company,"Unit 16A, Fort St, Blackburn BB1 5DP",,https://interests-api.parliament.uk/api/v1/Interests/9835,,,,,,
9233,Speaking engagement - AZ Liberty Network,,2024-08-04,2024-08-04,,Employment and earnings,5091,Nigel Farage,Speaking engagement,,,False,AZ Liberty Network,False,False,,1835 E Elliot Road Suite 102 Tempe 85284,,https://interests-api.parliament.uk/api/v1/Interests/9233,,,,,,
9624,Self-employed barrister - Coventry University,,2024-08-03,2024-08-04,,Employment and earnings,5204,Sarah Sackman,Self-employed barrister,,2024-02-06,True,Coventry University,False,False,,"Coventry University, Priory Street Town Centre, Coventry CV1 5FB",,https://interests-api.parliament.uk/api/v1/Interests/9624,,,,,,
9627,Self-employment barrister - St Mary's Catholic Primary School,,2024-08-03,2024-08-04,,Employment and earnings,5204,Sarah Sackman,Self-employment barrister,,2024-05-24,True,St Mary's Catholic Primary School,False,False,,"St Mary's Catholic Primary School, Station Road, Chingford London, E4 7BJ",,https://interests-api.parliament.uk/api/v1/Interests/9627,,,,,,
8448,Director and major shareholder - Lowe Holdings Ltd,,2024-07-31,2024-08-04,,Employment and earnings,5158,Rupert Lowe,Director and major shareholder,,,False,Lowe Holdings Ltd,False,True,Holding company for Lowe and Oliver Ltd electrical contactors,"Cumnor Road, Wootton, Oxford",,https://interests-api.parliament.uk/api/v1/Interests/8448,,,,,,
10356,Health Spokesperson (Councillor) - NHS FIfe,,2024-08-04,2024-08-04,,Employment and earnings,5275,Graeme Downie,Health Spokesperson (Councillor),2023-09-25,2024-07-04,True,NHS FIfe,False,False,NHS Board,"Hayfield Road, Kirkcaldy, Fife KY2 5AH",,https://interests-api.parliament.uk/api/v1/Interests/10356,,,,,,
8273,District Councillor - East Cambridgeshire District Council,,2024-07-30,2024-08-04,,Employment and earnings,5182,Charlotte Cane,District Councillor,,,False,East Cambridgeshire District Council,False,False,District Council,"The Grange, Nutholt Lane Ely CB7 4EE",,https://interests-api.parliament.uk/api/v1/Interests/8273,,,,,,
6186,Chief Executive - Cornwall Community Land Trust,,2024-08-04,2024-08-04,,Employment and earnings,227,Andrew George,Chief Executive,,,False,Cornwall Community Land Trust,False,False,Charity housing,"The Penwith Centre, Parade St, Penzance TR18 2ES",False,https://interests-api.parliament.uk/api/v1/Interests/6186,,,,,,
8018,Unitary  Councillor - Milton Keynes City Council,,2024-08-02,2024-08-04,,Employment and earnings,5139,Emily Darlington,Unitary  Councillor,,,False,Milton Keynes City Council,False,False,,1 Saxon Gate MK9 3EJ,,https://interests-api.parliament.uk/api/v1/Interests/8018,,,,,,
9527,Chair & Member of the Authority - Nottinghamshire & City of Nottingham Fire Authority,,2024-08-02,2024-08-04,,Employment and earnings,5146,Michael Payne,Chair & Member of the Authority,,,False,Nottinghamshire & City of Nottingham Fire Authority,False,True,,"Nottinghamshire Fire and Rescue Service Joint Headquarters, Sherwood Lodge, Arnold, Nottingham NG5 8PP",,https://interests-api.parliament.uk/api/v1/Interests/9527,,,,,,
7936,NHS surgeon - NHS golden jubilee,,2024-08-04,2024-08-04,2025-10-17,Employment and earnings,5213,Dr Zubir Ahmed,NHS surgeon,,2025-10-01,True,NHS golden jubilee,False,False,,Agamemon street Clydebank,,https://interests-api.parliament.uk/api/v1/Interests/7936,,,,,,
8909,Writing articles - Telegraph media group,,2024-08-04,2024-08-04,,Employment and earnings,5091,Nigel Farage,Writing articles,,,False,Telegraph media group,False,False,,"111 Buckingham Palace Road, London, SW1W 0DT",,https://interests-api.parliament.uk/api/v1/Interests/8909,,,,,,
8916,Social media work - Meta Platforms,,2024-08-04,2024-08-04,,Employment and earnings,5091,Nigel Farage,Social media work,,,False,Meta Platforms,False,False,,"1 Meta Way Menlo Park, CA",,https://interests-api.parliament.uk/api/v1/Interests/8916,,,,,,
8451,Consultant Solicitor - Rebel Law Ltd,,2024-07-31,2024-08-04,,Employment and earnings,5324,Sarah Russell,Consultant Solicitor,,,False,Rebel Law Ltd,False,False,Law firm specialising in employment law,"124 City Road, London EC1V 2NX",,https://interests-api.parliament.uk/api/v1/Interests/8451,,,,,,
6402,Freelance work as an Accountant and Business Consultant - Plumtree Hotels Ltd,,2024-08-03,2024-08-03,,Employment and earnings,5046,Andrew Ranger,Freelance work as an Accountant and Business Consultant,,,False,Plumtree Hotels Ltd,False,True,Management of hotels,"Dragon Hotel, Market Square, Montgomery, Powys SY15 6PA",,https://interests-api.parliament.uk/api/v1/Interests/6402,,,,,,
9605,Self-employed barrister - London Borough of Camden Planning Department,,2024-08-03,2024-08-03,,Employment and earnings,5204,Sarah Sackman,Self-employed barrister,,2024-05-24,True,London Borough of Camden Planning Department,False,False,,"5 Pancras Square, London N1C 4AG",,https://interests-api.parliament.uk/api/v1/Interests/9605,,,,,,
9814,Editor - Millennium Steel Publishing,,2024-08-03,2024-08-03,,Employment and earnings,5116,Chris McDonald,Editor,,,False,Millennium Steel Publishing,True,False,Publishing scientific and technological journals for industry.,,,https://interests-api.parliament.uk/api/v1/Interests/9814,,,,,,
5989,Barrister - Legal Aid Agency,,2024-08-03,2024-08-03,,Employment and earnings,5067,Tony Vaughan,Barrister,,,False,Legal Aid Agency,False,False,"Legal services provided by me to a lay client, who is assisted by the Agency.","102 Petty France, London SW1H 9AJ",,https://interests-api.parliament.uk/api/v1/Interests/5989,,,,,,
7333,Senior Parliamentary Assistant - John Spellar MP - IPSA,,2024-08-02,2024-08-02,,Employment and earnings,5266,Mike Tapp,Senior Parliamentary Assistant - John Spellar MP,,2024-07-05,True,IPSA,False,False,,"85 Strand, Marylebone WC2R 0DW",,https://interests-api.parliament.uk/api/v1/Interests/7333,,,,,,
7008,Borough Councillor & Deputy Leader of the Council (Deputy Leader up to 14 October 2024) - Gedling Borough Council,,2024-08-02,2024-08-02,2024-11-20,Employment and earnings,5146,Michael Payne,Borough Councillor & Deputy Leader of the Council (Deputy Leader up to 14 October 2024),,,False,Gedling Borough Council,False,False,,"Civic Centre, Arnot Hill Park, Arnold, Nottingham NG5 6LU",,https://interests-api.parliament.uk/api/v1/Interests/7008,,,,,,
9486,County Councillor - Nottinghamshire County Council,,2024-08-02,2024-08-02,,Employment and earnings,5146,Michael Payne,County Councillor,,,False,Nottinghamshire County Council,False,False,,"County Hall, Loughborough Road, West Bridgford, Nottinghamshire NG2 7PQ",,https://interests-api.parliament.uk/api/v1/Interests/9486,,,,,,
6542,Tribunal member for PSA (phone paid services/ofcom) - PSA - Phone Paid Services Authority,,2024-08-02,2024-08-02,2024-11-25,Employment and earnings,5111,Martin Wrigley,Tribunal member for PSA (phone paid services/ofcom),,2025-01-31,True,PSA - Phone Paid Services Authority,False,False,Telecoms regulator,"c/o Ofcom, Riverside House. 2a Southwark Bridge Road, London SE1 9HA",,https://interests-api.parliament.uk/api/v1/Interests/6542,,,,,,
6850,Unitary Councillor - Wiltshire Council,,2024-08-02,2024-08-02,,Employment and earnings,5214,Brian Mathew,Unitary Councillor,,,False,Wiltshire Council,False,False,,"County Hall, Bythesea road, Trowbridge, Wiltshire BA14 8JN",,https://interests-api.parliament.uk/api/v1/Interests/6850,,,,,,
8967,Company director - Open Door Property Ltd,,2024-08-02,2024-08-02,2025-08-26,Employment and earnings,5047,James Naish,Company director,,2025-08-06,True,Open Door Property Ltd,False,True,Property sales and consulting,"Office 5 Rec 2, Retford Enterprise Centre, Randall Way, Retford, DN22 7GR",,https://interests-api.parliament.uk/api/v1/Interests/8967,,,,,,
6646,Councillor - Merton Council,,2024-08-02,2024-08-02,,Employment and earnings,5321,Mr Paul Kohler,Councillor,,,False,Merton Council,False,False,,"Merton Civic Centre, London Road, Morden SM4 5DX",,https://interests-api.parliament.uk/api/v1/Interests/6646,,,,,,
6762,"Teaching and researching - Blavatnik School of Government, Oxford University",,2024-08-02,2024-08-02,,Employment and earnings,5346,Calum Miller,Teaching and researching,,2024-07-15,True,"Blavatnik School of Government, Oxford University",False,False,,"Radcliffe Observatory Quarter, Woodstock Road, Oxford OX2 6GG",,https://interests-api.parliament.uk/api/v1/Interests/6762,,,,,,
6036,Visiting Professor in Geopolitics - Royal Holloway University,,2024-08-02,2024-08-02,2025-04-14,Employment and earnings,5288,Dr Al Pinkerton,Visiting Professor in Geopolitics,2008-09-10,,False,Royal Holloway University,False,False,Higher Education institution,"Egham, Surrey TW20 0EX",,https://interests-api.parliament.uk/api/v1/Interests/6036,,,,,,
6764,Elected county councillor - Oxfordshire County Council,,2024-08-02,2024-08-02,2025-05-07,Employment and earnings,5346,Calum Miller,Elected county councillor,,2025-05-01,True,Oxfordshire County Council,False,False,,"New Road, Oxford OX1 1ND",,https://interests-api.parliament.uk/api/v1/Interests/6764,,,,,,
7633,Local Authority Councillor - Derby City Council,,2024-08-02,2024-08-02,,Employment and earnings,5176,Baggy Shanker,Local Authority Councillor,2008-05-04,,False,Derby City Council,False,False,Local Authority,"Council House, Corporation Street, Derby DE1 2FS",,https://interests-api.parliament.uk/api/v1/Interests/7633,,,,,,
6584,District Councillor - Stratford-on-Avon District Council,,2024-08-01,2024-08-01,2025-04-23,Employment and earnings,5122,Manuela Perteghella,District Councillor,,2025-03-14,True,Stratford-on-Avon District Council,False,False,local authority,Elizabeth House Church Street Stratford upon Avon CV37 6HX,,https://interests-api.parliament.uk/api/v1/Interests/6584,,,,,,
6167,Councillor - East Sussex County Council,,2024-08-01,2024-08-01,2025-09-20,Employment and earnings,5265,James MacCleary,Councillor,,2026-05-07,True,East Sussex County Council,False,False,,"County Hall, Lewes, BN7 1UE",,https://interests-api.parliament.uk/api/v1/Interests/6167,,,,,,
6994,Columnist - Daily Telegraph,,2024-08-01,2024-08-01,2025-09-10,Employment and earnings,5062,Nick Timothy,Columnist,,2025-04-06,True,Daily Telegraph,False,False,National newspaper,"111 Buckingham Palace Road, London SW1W 0DT",,https://interests-api.parliament.uk/api/v1/Interests/6994,,,,,,
6258,Director - Gisborne Ltd,,2024-08-01,2024-08-01,,Employment and earnings,5203,Alison Griffiths,Director,,,False,Gisborne Ltd,True,True,"Strategy and Marketing Consulting, Technology Sector",,,https://interests-api.parliament.uk/api/v1/Interests/6258,,,,,,
7072,Governance Advisor - Dementia UK,,2024-08-01,2024-08-01,,Employment and earnings,5255,Joe Robertson,Governance Advisor,,2024-07-05,True,Dementia UK,False,False,UK Charity,"1 Aldgate, London EC3N 1RE",,https://interests-api.parliament.uk/api/v1/Interests/7072,,,,,,
6289,Councillor at Gravesham Borough Council - Gravesham Borough Council,,2024-07-31,2024-07-31,,Employment and earnings,5269,Dr Lauren Sullivan,Councillor at Gravesham Borough Council,,,False,Gravesham Borough Council,False,False,,"Civic Centre, Gravesend, Kent DA12 1AU",,https://interests-api.parliament.uk/api/v1/Interests/6289,,,,,,
7897,Councillor - Chelmsford City Council,,2024-07-31,2024-07-31,2025-03-31,Employment and earnings,5073,Marie Goldman,Councillor,,2025-03-19,True,Chelmsford City Council,False,False,Chelmsford City Council,"Civic Centre, Duke Street, Chelmsford CM1 1JE",,https://interests-api.parliament.uk/api/v1/Interests/7897,,,,,,
8300,Director - Sask Optics Ltd,,2024-07-31,2024-07-31,,Employment and earnings,5120,Shockat Adam,Director,,,False,Sask Optics Ltd,False,True,Chain of Optometry Practices,"T03 The Atkins Building, Lower Bond Street, Hinckley, Leicestershire LE10 1QU",,https://interests-api.parliament.uk/api/v1/Interests/8300,,,,,,
6012,Employment - Joseph Rowntree Foundation,,2024-07-31,2024-07-31,,Employment and earnings,5282,Dan Tomlinson,Employment,,2024-07-06,True,Joseph Rowntree Foundation,False,False,,"40 Water End, York YO30 6WP",,https://interests-api.parliament.uk/api/v1/Interests/6012,,,,,,
3869,Speaking engagements - Coulthwaite Group Pte Ltd (trading as CWG Speakers),,,2024-07-31,2024-05-02,Employment and earnings,4475,Suella Braverman,Speaking engagements,,,False,Coulthwaite Group Pte Ltd (trading as CWG Speakers),False,False,,"21 Woodlands Close, #08- 44, Primz Bizhub Singapore 737854",True,https://interests-api.parliament.uk/api/v1/Interests/3869,,,,,,
7644,"Barrister (employee) and until 3 February 2025, Director - Bank View Solicitors Limited",,2024-07-30,2024-07-30,2025-09-24,Employment and earnings,5231,Mr Adnan Hussain,"Barrister (employee) and until 3 February 2025, Director",,,False,Bank View Solicitors Limited,False,True,,"Bank View House, 55 Preston New Road, Blackburn",,https://interests-api.parliament.uk/api/v1/Interests/7644,,,,,,
6887,"County Councillor (and until 29 July 2024, Cabinet Member) - Carmarthenshire County Council",,2024-07-30,2024-07-30,2025-02-11,Employment and earnings,5177,Ann Davies,"County Councillor (and until 29 July 2024, Cabinet Member)",2017-05-05,2025-01-20,True,Carmarthenshire County Council,False,False,,"County Hall, Carmarthen SA31 1JP",,https://interests-api.parliament.uk/api/v1/Interests/6887,,,,,,
8078,Metro Mayor of the West of England - West of England Mayoral Combined Authority,,2024-07-30,2024-07-30,2025-05-17,Employment and earnings,221,Dan Norris,Metro Mayor of the West of England,,2025-05-01,True,West of England Mayoral Combined Authority,False,False,Regional Government,"Rivergate House, 70 Redcliff Street, Redcliff Bristol BS1 6AL",False,https://interests-api.parliament.uk/api/v1/Interests/8078,,,,,,
7158,Elected Member of East Dunbartonshire Council - East Dunbartonshire Council,,2024-07-30,2024-07-30,2024-12-16,Employment and earnings,5157,Susan Murray,Elected Member of East Dunbartonshire Council,,2024-11-30,True,East Dunbartonshire Council,False,False,I have now resigned as an elected member of East Dunbartonshire Council,"Southbank Marina, 12 Strathkelvin Place, Kirkintilloch, Glasgow, G66 1TJ",,https://interests-api.parliament.uk/api/v1/Interests/7158,,,,,,
8268,Councillor - Perth and Kinross Council,,2024-07-30,2024-07-30,2024-11-20,Employment and earnings,5196,Brian Leishman,Councillor,,2024-07-31,True,Perth and Kinross Council,False,False,Local Government.,"Pullar House, Kinnoull Street, Perth PH1 5GD",,https://interests-api.parliament.uk/api/v1/Interests/8268,,,,,,
6678,County Councillor - Oxfordshire County Council,,2024-07-29,2024-07-29,2025-05-07,Employment and earnings,5296,Freddie van Mierlo,County Councillor,,2025-05-01,True,Oxfordshire County Council,False,False,,"County Hall, New Road, Oxford OX1 1ND",,https://interests-api.parliament.uk/api/v1/Interests/6678,,,,,,
6759,Borough Councillor - Eastleigh Borough Council,,2024-07-29,2024-07-29,2025-02-03,Employment and earnings,5040,Liz Jarvis,Borough Councillor,,2025-01-28,True,Eastleigh Borough Council,False,False,Borough Council,"Eastleigh House, Upper Market Street SO50 9YN",,https://interests-api.parliament.uk/api/v1/Interests/6759,,,,,,
8046,Strategic Advisor to the Cannabinoid Research and Development Group (CRDG) at the Centre for Medicinal Cannabis (CMC). - The Centre for Medicinal Cannabis (CMC).,,2024-07-29,2024-07-29,2024-12-03,Employment and earnings,4020,George Freeman,Strategic Advisor to the Cannabinoid Research and Development Group (CRDG) at the Centre for Medicinal Cannabis (CMC).,2024-04-05,2024-11-30,True,The Centre for Medicinal Cannabis (CMC).,False,False,"CMC is a not for profit industry membership organisation focused on clinical research and development of cannabinoid medicines. The Centre has three platforms with the following trading names: The Association for the Cannabinoid Industry (ACI), which relates to cannabinoids as a food ingredient; The Medical Cannabis Alliance (MCA), which is for Cannabis Based Medical Products; and Cannabinoid Research and Development Group (CRDG)","10 Queen Street Place, London, England EC4R 1BE.",True,https://interests-api.parliament.uk/api/v1/Interests/8046,,,,,,
7603,"Chairman of Advisory Board, Nodenza Venture Partners - Nodenza Venture Partners",,2024-07-26,2024-07-26,2024-10-22,Employment and earnings,4020,George Freeman,"Chairman of Advisory Board, Nodenza Venture Partners",2024-05-20,,False,Nodenza Venture Partners,False,False,Nodenza Venture Partners is a venture capital firm specialising in biotechnology and medical device investments.,"228 Park Avenue South, PMB 67135, New York, NY, 10003-1502, United States",True,https://interests-api.parliament.uk/api/v1/Interests/7603,,,,,,
7520,Partner of a law firm and consultant to a law firm. - Shepherd and Wedderburn LLP,,2024-07-26,2024-07-26,,Employment and earnings,5170,John Grady,Partner of a law firm and consultant to a law firm.,,2024-07-05,True,Shepherd and Wedderburn LLP,False,False,A law firm,9 Haymarket Square Edinburgh EH3 8FY,,https://interests-api.parliament.uk/api/v1/Interests/7520,,,,,,
6484,Councillor - Calderdale Council,,2024-07-26,2024-07-26,,Employment and earnings,5295,Josh Fenton-Glynn,Councillor,,,False,Calderdale Council,False,False,,Halifax Town Hall HX1,,https://interests-api.parliament.uk/api/v1/Interests/6484,,,,,,
7605,"Science and Technology Advisor, The Pioneer Group - Pioneer Group Limited",,2024-07-26,2024-07-26,2024-10-22,Employment and earnings,4020,George Freeman,"Science and Technology Advisor, The Pioneer Group",2024-05-22,,False,Pioneer Group Limited,False,False,"Pioneer is a private property management company that provides venture building, incubation, and venture investment support to early stage companies, as well as the development and operation of life science incubator facilities.","New Derwent House, 69-73 Theobalds Road, London WC1X 8TA",True,https://interests-api.parliament.uk/api/v1/Interests/7605,,,,,,
7327,Elected Councillor - North Warwickshire Borough Council,,2024-07-25,2024-07-25,,Employment and earnings,5065,Rachel Taylor,Elected Councillor,,,False,North Warwickshire Borough Council,False,False,District Council,"The Council House, South Street, Atherstone, Warwickshire CV9 1DE",,https://interests-api.parliament.uk/api/v1/Interests/7327,,,,,,
7340,Strategy Advisor NHS England - NHS England,,2024-07-25,2024-07-25,,Employment and earnings,5300,Kevin McKenna,Strategy Advisor NHS England,,2024-07-05,True,NHS England,False,False,NHS,"NHS England, Wellington House, London SE1 8EG",,https://interests-api.parliament.uk/api/v1/Interests/7340,,,,,,
6522,District Councillor - South Oxfordshire District Council,,2024-07-25,2024-07-25,,Employment and earnings,5296,Freddie van Mierlo,District Councillor,,2025-03-11,True,South Oxfordshire District Council,False,False,,"Abbey House, Abbey Close, Abingdon OX14 3JE",,https://interests-api.parliament.uk/api/v1/Interests/6522,,,,,,
6941,private medical practice - Private patient payments,,2024-07-25,2024-07-25,,Employment and earnings,5163,Peter Prinsley,private medical practice,2024-07-16,,False,Private patient payments,False,False,,[private],,https://interests-api.parliament.uk/api/v1/Interests/6941,,,,,,
7260,District Councillor - Mid Devon District Council,,2024-07-24,2024-07-24,2025-11-13,Employment and earnings,5252,Rachel Gilmour,District Councillor,,2025-03-14,True,Mid Devon District Council,False,False,Local Government,"Phoenix House, Phoenix Lane, Tiverton, Devon EX16 6PP",,https://interests-api.parliament.uk/api/v1/Interests/7260,,,,,,
6315,NHS consultant surgeon - James Paget University Hospital,,2024-07-24,2024-07-24,,Employment and earnings,5163,Peter Prinsley,NHS consultant surgeon,,,False,James Paget University Hospital,False,False,,Great Yarmouth NR31 6LA,,https://interests-api.parliament.uk/api/v1/Interests/6315,,,,,,
6322,private medical practice - Peter Prinsley private medical practice,,2024-07-24,2024-07-24,,Employment and earnings,5163,Peter Prinsley,private medical practice,,,False,Peter Prinsley private medical practice,False,False,,"Spire Hospital Old Watton Road, Norwich NR4 7TD",,https://interests-api.parliament.uk/api/v1/Interests/6322,,,,,,
6238,Highland Councillor - Highland Council,,2024-07-24,2024-07-24,,Employment and earnings,5362,Mr Angus MacDonald,Highland Councillor,,,False,Highland Council,False,False,,"Glenurquart Road, Inverness IV3 5NX",,https://interests-api.parliament.uk/api/v1/Interests/6238,,,,,,
7276,Councillor - Cheshire East Council,,2024-07-24,2024-07-24,,Employment and earnings,5273,Connor Naismith,Councillor,,2024-07-11,True,Cheshire East Council,False,False,Local Authority,"Westfields, Middlewich Road, Sandbach, Cheshire CW11 1HZ",,https://interests-api.parliament.uk/api/v1/Interests/7276,,,,,,
7043,County Councillor - Surrey County Council,,2024-07-23,2024-07-23,,Employment and earnings,5297,Rebecca Paul,County Councillor,,,False,Surrey County Council,False,False,,"Woodhatch Place, 11 Cockshot Hill, Reigate RH2 8EF",,https://interests-api.parliament.uk/api/v1/Interests/7043,,,,,,
6997,"Head of Campaigns, Communications and DIgital, the TUC - Trades Union Congress",,2024-07-23,2024-07-23,,Employment and earnings,5048,Antonia Bance,"Head of Campaigns, Communications and DIgital, the TUC",,2024-07-05,True,Trades Union Congress,False,False,Trade union,"Congress House, Great Russell St, London WC1B 3LS",,https://interests-api.parliament.uk/api/v1/Interests/6997,,,,,,
6919,Legal Services - Bachubhai Munim & Co,,2024-07-22,2024-07-22,,Employment and earnings,1508,Sir Geoffrey Cox,Legal Services,2016-09-01,2018-07-18,True,Bachubhai Munim & Co,False,False,Advocates & Solicitors,"312 Tulsiani Chambers, Mumbai",,https://interests-api.parliament.uk/api/v1/Interests/6919,,,,,,
6775,West Sussex County Councillor - West Sussex County Council,,2024-07-22,2024-07-22,,Employment and earnings,5329,John Milne,West Sussex County Councillor,,,False,West Sussex County Council,False,False,,"County Hall, Chichester, West Sussex PO19 1RG",,https://interests-api.parliament.uk/api/v1/Interests/6775,,,,,,
6832,Solicitor - Thompsons Solicitors LLP,,2024-07-22,2024-07-22,,Employment and earnings,5230,Warinder Juss,Solicitor,,,False,Thompsons Solicitors LLP,False,False,,"Congress House, Great Russell Street, London WC1B 3LW",,https://interests-api.parliament.uk/api/v1/Interests/6832,,,,,,
6777,District Councillor - Horsham District Council,,2024-07-22,2024-07-22,2024-11-06,Employment and earnings,5329,John Milne,District Councillor,2019-05-06,2024-10-11,True,Horsham District Council,False,False,,"Park House, North Street, Horsham RH12 1RL",,https://interests-api.parliament.uk/api/v1/Interests/6777,,,,,,
