ID,Parent Interest ID,Summary,Registration Date,Published Date,Updated Date,Category,Member,MNIS ID,AroseOn,EndDate,DonorName,Description,MiscellaneousInterestType,Link_1
1689,,"A non-Executive Director of The Oxford Group, whose programmes include initiatives to develop sustainable communities; making films about conflict resolution; working to bring trust and integrity into the business and financial sectors; helping young people to find a sense of vocation. This is an unpaid role.",2022-09-13,2023-12-17,,Miscellaneous,Mike Kane,4316,28/05/2022,,,"A non-Executive Director of The Oxford Group, whose programmes include initiatives to develop sustainable communities; making films about conflict resolution; working to bring trust and integrity into the business and financial sectors; helping young people to find a sense of vocation. This is an unpaid role.",Unpaid role,https://interests-api.parliament.uk/api/v1/Interests/1689
1688,,Vice-Chairman of the Conservative Party.,2021-01-11,2023-12-17,2021-07-30,Miscellaneous,Andrew Bowie,4601,28/07/2019,,,Vice-Chairman of the Conservative Party.,Formal role with a party organisation,https://interests-api.parliament.uk/api/v1/Interests/1688
1729,,Non-practising solicitor.,2015-06-06,2023-12-17,,Miscellaneous,Richard Burgon,4493,,,,Non-practising solicitor.,Other,https://interests-api.parliament.uk/api/v1/Interests/1729
1731,,"Unpaid Chair of the Brazil Solidarity Initiative, a network established to campaign for human rights in Brazil.",2023-03-24,2023-12-17,,Miscellaneous,Richard Burgon,4493,22/11/2018,,,"Unpaid Chair of the Brazil Solidarity Initiative, a network established to campaign for human rights in Brazil.",Unpaid role,https://interests-api.parliament.uk/api/v1/Interests/1731
1829,,I am a member of the Law Society of England and Wales.,2017-06-26,2023-12-17,,Miscellaneous,John Lamont,4608,,,,I am a member of the Law Society of England and Wales.,Other,https://interests-api.parliament.uk/api/v1/Interests/1829
1830,,I am a trustee of the St Abbs Lifeboat Trust.,2017-06-26,2023-12-17,,Miscellaneous,John Lamont,4608,,,,I am a trustee of the St Abbs Lifeboat Trust.,Unpaid role,https://interests-api.parliament.uk/api/v1/Interests/1830
1849,,"Registered Nurse at the Bank Universities Hospitals, Birmingham.",2022-03-21,2023-12-17,,Miscellaneous,Paulette Hamilton,4938,,,,"Registered Nurse at the Bank Universities Hospitals, Birmingham.",Other,https://interests-api.parliament.uk/api/v1/Interests/1849
1967,,"Unpaid Vice President of the LGA, which works with councils to support, promote and improve local government.",2021-03-09,2023-12-17,,Miscellaneous,Rachel Hopkins,4873,30/12/2020,,,"Unpaid Vice President of the LGA, which works with councils to support, promote and improve local government.",Unpaid role,https://interests-api.parliament.uk/api/v1/Interests/1967
2055,,An unpaid Vice-President of the Local Government Association (LGA).,2020-10-21,2023-12-17,,Miscellaneous,David Simmonds,4872,19/10/2020,,,An unpaid Vice-President of the Local Government Association (LGA).,Unpaid role,https://interests-api.parliament.uk/api/v1/Interests/2055
2061,,Barrister (not practising),,2023-12-17,,Miscellaneous,Andy Slaughter,1516,,,,Barrister (not practising),Other,https://interests-api.parliament.uk/api/v1/Interests/2061
2099,,"Unremunerated trustee of the Global Warming Policy Foundation, an education charity.",2015-10-23,2023-12-17,,Miscellaneous,Graham Stringer,449,01/10/2015,,,"Unremunerated trustee of the Global Warming Policy Foundation, an education charity.",Unpaid role,https://interests-api.parliament.uk/api/v1/Interests/2099
2101,,"Member (unpaid) of the Political Advisory Board of the Foundation for Independence, a pro-Brexit group.",2020-05-22,2023-12-17,,Miscellaneous,Graham Stringer,449,01/04/2020,,,"Member (unpaid) of the Political Advisory Board of the Foundation for Independence, a pro-Brexit group.",Unpaid role,https://interests-api.parliament.uk/api/v1/Interests/2101
2117,,Non-practising barrister.,,2023-12-17,,Miscellaneous,Emily Thornberry,1536,,,,Non-practising barrister.,Other,https://interests-api.parliament.uk/api/v1/Interests/2117
2120,,"Chair of Trustees, Traidcraft Foundation.",2018-05-10,2023-12-17,,Miscellaneous,Sir Stephen Timms,163,,,,"Chair of Trustees, Traidcraft Foundation.",Unpaid role,https://interests-api.parliament.uk/api/v1/Interests/2120
1407,,"Trustee of Tourism for all, a charity.",2017-07-06,2023-12-17,,Miscellaneous,Ed Davey,188,,,,"Trustee of Tourism for all, a charity.",Unpaid role,https://interests-api.parliament.uk/api/v1/Interests/1407
1960,,"Director of the Satellite Finance Network, a company limited by guarantee providing support and advice for space sector start-up companies. This is an unpaid role, requiring one day per month commitment.",2021-03-15,2023-12-17,,Miscellaneous,Mark Garnier,4074,10/03/2021,,,"Director of the Satellite Finance Network, a company limited by guarantee providing support and advice for space sector start-up companies. This is an unpaid role, requiring one day per month commitment.",Unpaid role,https://interests-api.parliament.uk/api/v1/Interests/1960
1966,,A Non-executive Director of Space Solar Group Holdings Ltd. A UK company established to lead the development of space based solar power. This is an unpaid role.,2023-01-09,2023-12-17,2023-06-28,Miscellaneous,Mark Garnier,4074,09/01/2023,,,A Non-executive Director of Space Solar Group Holdings Ltd. A UK company established to lead the development of space based solar power. This is an unpaid role.,Unpaid role,https://interests-api.parliament.uk/api/v1/Interests/1966
1450,,A company in which Millgap Ltd holds beneficial ownership of 0.375% became accredited for the Coronavirus Business Interruption Loan Scheme.,2021-05-25,2023-12-17,,Miscellaneous,Chris Philp,4503,22/03/2021,,,A company in which Millgap Ltd holds beneficial ownership of 0.375% became accredited for the Coronavirus Business Interruption Loan Scheme.,Other,https://interests-api.parliament.uk/api/v1/Interests/1450
2084,,"Solicitor, non-practising since 8 May 2015.",2021-07-19,2023-12-17,,Miscellaneous,Jo Stevens,4425,,,,"Solicitor, non-practising since 8 May 2015.",Other,https://interests-api.parliament.uk/api/v1/Interests/2084
1406,,"Board Member (unpaid) of Fit for the Future, a network of mainly charities helping organisations to become climate-friendly and resilient.",2017-07-06,2023-12-17,2020-01-31,Miscellaneous,Ed Davey,188,,,,"Board Member (unpaid) of Fit for the Future, a network of mainly charities helping organisations to become climate-friendly and resilient.",Unpaid role,https://interests-api.parliament.uk/api/v1/Interests/1406
1437,,Director of Vintage Ghetto (unpaid).,2023-08-10,2023-12-17,,Miscellaneous,Sarah Dyke,4995,,,,Director of Vintage Ghetto (unpaid).,Unpaid role,https://interests-api.parliament.uk/api/v1/Interests/1437
1976,,Member of the British Equine Veterinary Association.,2020-01-07,2023-12-17,,Miscellaneous,Dr Neil Hudson,4853,,,,Member of the British Equine Veterinary Association.,Other,https://interests-api.parliament.uk/api/v1/Interests/1976
1993,,"Barrister, not currently practising.",2015-06-04,2023-12-17,,Miscellaneous,Imran Hussain,4394,,,,"Barrister, not currently practising.",Other,https://interests-api.parliament.uk/api/v1/Interests/1993
1269,,Barrister (non-practising).,,2023-12-17,,Miscellaneous,Sir Jeremy Wright,1560,,,,Barrister (non-practising).,Other,https://interests-api.parliament.uk/api/v1/Interests/1269
1281,,"Deputy Chairman of the Conservative Party. This post carries a part-time salary, first paid on 31 August 2022.",2022-08-31,2023-12-17,,Miscellaneous,Matt Vickers,4844,09/07/2022,,,"Deputy Chairman of the Conservative Party. This post carries a part-time salary, first paid on 31 August 2022.",Formal role with a party organisation,https://interests-api.parliament.uk/api/v1/Interests/1281
1509,,"Director of EastSide Partnership, which is a broad-based social partnership with community, statutory, political and business members who are dedicated to the regeneration of East Belfast. This is an unpaid role.",2019-08-06,2023-12-17,,Miscellaneous,Gavin Robinson,4360,01/08/2019,,,"Director of EastSide Partnership, which is a broad-based social partnership with community, statutory, political and business members who are dedicated to the regeneration of East Belfast. This is an unpaid role.",Unpaid role,https://interests-api.parliament.uk/api/v1/Interests/1509
1592,,Director of IM Campaigns Ltd (dormant). This is an unpaid role.,2023-07-31,2023-12-17,,Miscellaneous,Ian Murray,3966,02/06/2020,,,Director of IM Campaigns Ltd (dormant). This is an unpaid role.,Unpaid role,https://interests-api.parliament.uk/api/v1/Interests/1592
1603,,A trustee of World Horse Welfare. This position is not remunerated.,2016-01-13,2023-12-17,,Miscellaneous,Caroline Nokes,4048,17/12/2015,,,A trustee of World Horse Welfare. This position is not remunerated.,Unpaid role,https://interests-api.parliament.uk/api/v1/Interests/1603
1639,,A Director of Sky Blues in the Community. This is an unpaid role.,2023-08-03,2023-12-17,,Miscellaneous,Taiwo Owatemi,4779,09/08/2021,,,A Director of Sky Blues in the Community. This is an unpaid role.,Unpaid role,https://interests-api.parliament.uk/api/v1/Interests/1639
1644,,A Director of the Commonwealth Parliamentary Association (United Kingdom Branch). This is an unpaid role.,2023-08-03,2023-12-17,,Miscellaneous,Taiwo Owatemi,4779,23/03/2023,,,A Director of the Commonwealth Parliamentary Association (United Kingdom Branch). This is an unpaid role.,Unpaid role,https://interests-api.parliament.uk/api/v1/Interests/1644
1694,,"Member (unpaid) of the panel for the Community Foundation for Staffordshire’s We Love the Moorlands programme, which offers funding support to assist grassroots community and voluntary organisations that are based across the Moorlands area.",2021-11-11,2023-12-17,,Miscellaneous,Dame Karen Bradley,4110,25/06/2021,,,"Member (unpaid) of the panel for the Community Foundation for Staffordshire’s We Love the Moorlands programme, which offers funding support to assist grassroots community and voluntary organisations that are based across the Moorlands area.",Unpaid role,https://interests-api.parliament.uk/api/v1/Interests/1694
1695,,Chair of the new Restoring Your Railway Leek – Stoke Board and Steering Committee. This is an unpaid role and meetings are monthly.,2022-04-08,2023-12-17,,Miscellaneous,Dame Karen Bradley,4110,10/12/2021,,,Chair of the new Restoring Your Railway Leek – Stoke Board and Steering Committee. This is an unpaid role and meetings are monthly.,Unpaid role,https://interests-api.parliament.uk/api/v1/Interests/1695
1732,,Trustee of the National Youth Theatre of Great Britain. This is an unpaid role.,2023-03-03,2023-12-17,,Miscellaneous,Dawn Butler,1489,24/11/2022,,,Trustee of the National Youth Theatre of Great Britain. This is an unpaid role.,Unpaid role,https://interests-api.parliament.uk/api/v1/Interests/1732
1734,,A Member of the Executive Committee of the British Group of the Inter-Parliamentary Union. This is an unpaid role.,2023-08-23,2023-12-17,,Miscellaneous,Dame Harriett Baldwin,4107,04/03/2020,,,A Member of the Executive Committee of the British Group of the Inter-Parliamentary Union. This is an unpaid role.,Unpaid role,https://interests-api.parliament.uk/api/v1/Interests/1734
1746,,"Unpaid director of Addiction Recovery Now Ltd, a company limited by guarantee. The company researches addiction issues and seeks to promote visible recovery in society.",2021-08-24,2023-12-17,,Miscellaneous,Dan Carden,4651,28/07/2021,,,"Unpaid director of Addiction Recovery Now Ltd, a company limited by guarantee. The company researches addiction issues and seeks to promote visible recovery in society.",Unpaid role,https://interests-api.parliament.uk/api/v1/Interests/1746
1808,,"Unpaid Director of the New Social Covenant Unit Ltd, a company which supports social policy research.",2021-01-13,2023-12-17,,Miscellaneous,Danny Kruger,4858,08/12/2020,,,"Unpaid Director of the New Social Covenant Unit Ltd, a company which supports social policy research.",Unpaid role,https://interests-api.parliament.uk/api/v1/Interests/1808
1826,,Solicitor (non-practising).,2017-06-26,2023-12-17,,Miscellaneous,John Lamont,4608,,,,Solicitor (non-practising).,Other,https://interests-api.parliament.uk/api/v1/Interests/1826
1855,,Honorary member of the Catholic Union.,2015-09-15,2023-12-17,,Miscellaneous,Mrs Emma Lewell-Buck,4277,,,,Honorary member of the Catholic Union.,Other,https://interests-api.parliament.uk/api/v1/Interests/1855
1864,,Vice President of the Chartered Trading Standards Institute.,2017-07-07,2023-12-17,,Miscellaneous,Carolyn Harris,4480,01/05/2017,,,Vice President of the Chartered Trading Standards Institute.,Other,https://interests-api.parliament.uk/api/v1/Interests/1864
1917,,"Solicitor, England and Wales (non-practising).",2015-06-05,2023-12-17,,Miscellaneous,Alan Mak,4484,,,,"Solicitor, England and Wales (non-practising).",Other,https://interests-api.parliament.uk/api/v1/Interests/1917
1921,,"Bursary Campaign Ambassador for St. Peter’s School, York (registered charity). This is an unpaid role.",2022-06-01,2023-12-17,,Miscellaneous,Alan Mak,4484,01/06/2022,,,"Bursary Campaign Ambassador for St. Peter’s School, York (registered charity). This is an unpaid role.",Unpaid role,https://interests-api.parliament.uk/api/v1/Interests/1921
1394,,"Vice President of the Local Government Association (LGA), which works with councils to support, promote and improve local government.",2020-11-20,2023-12-17,,Miscellaneous,Daisy Cooper,4769,10/03/2020,,,"Vice President of the Local Government Association (LGA), which works with councils to support, promote and improve local government.",Unpaid role,https://interests-api.parliament.uk/api/v1/Interests/1394
1926,,"A member of the Advisory Council for the Council on Geostrategy, an independent non-profit organisation that generates new geostrategic thinking for a more competitive age. This is an unpaid role.",2023-06-09,2023-12-17,,Miscellaneous,Richard Foord,4942,23/05/2023,,,"A member of the Advisory Council for the Council on Geostrategy, an independent non-profit organisation that generates new geostrategic thinking for a more competitive age. This is an unpaid role.",Unpaid role,https://interests-api.parliament.uk/api/v1/Interests/1926
1951,,"A Member and Director of Stop Fire and Rehire Ltd, a company limited by guarantee set up to manage financial support for my Private Members Bill campaign. The company is a not for profit company and the position is entirely unpaid.",2021-09-10,2023-12-17,,Miscellaneous,Barry Gardiner,146,06/07/2021,,,"A Member and Director of Stop Fire and Rehire Ltd, a company limited by guarantee set up to manage financial support for my Private Members Bill campaign. The company is a not for profit company and the position is entirely unpaid.",Unpaid role,https://interests-api.parliament.uk/api/v1/Interests/1951
1957,,Member of the Court of the Worshipful Company of Coachmakers and Coach Harness Makers of London.,,2023-12-17,2015-05-19,Miscellaneous,Mark Garnier,4074,,,,Member of the Court of the Worshipful Company of Coachmakers and Coach Harness Makers of London.,Other,https://interests-api.parliament.uk/api/v1/Interests/1957
1494,,I was appointed as a member of the Board of the Westminster Foundation for Democracy for a three-year term. This is an unpaid role.,2022-09-26,2023-12-17,,Miscellaneous,Yasmin Qureshi,3924,07/09/2022,,,I was appointed as a member of the Board of the Westminster Foundation for Democracy for a three-year term. This is an unpaid role.,Unpaid role,https://interests-api.parliament.uk/api/v1/Interests/1494
2145,,"Chair of the China Research Group, a company limited by guarantee which considers the longer term challenges arising from the rise of China and hosts relevant events online. This is an unpaid role.",2020-11-06,2023-12-17,2024-01-22,Miscellaneous,Tom Tugendhat,4462,25/04/2020,22/09/2022,,"Chair of the China Research Group, a company limited by guarantee which considers the longer term challenges arising from the rise of China and hosts relevant events online. This is an unpaid role.",Unpaid role,https://interests-api.parliament.uk/api/v1/Interests/2145
1539,,Solicitor (currently non-practising).,,2023-12-17,,Miscellaneous,Catherine McKinnell,4125,,,,Solicitor (currently non-practising).,Other,https://interests-api.parliament.uk/api/v1/Interests/1539
2006,,"Sole Trader, Christine Jardine Communications (inactive), media consultancy.",2017-07-06,2023-12-17,,Miscellaneous,Christine Jardine,4634,,,,"Sole Trader, Christine Jardine Communications (inactive), media consultancy.",Other,https://interests-api.parliament.uk/api/v1/Interests/2006
1634,,Unpaid director of Afrika Connekt Ltd; a clothing company.,2020-01-07,2023-12-17,2024-05-16,Miscellaneous,Taiwo Owatemi,4779,,15/06/2023,,Unpaid director of Afrika Connekt Ltd; a clothing company.,Unpaid role,https://interests-api.parliament.uk/api/v1/Interests/1634
1264,,Trustee of Pelican Park Community Trust. This is an unpaid role.,2022-12-02,2023-12-17,,Miscellaneous,Karl Turner,4030,30/11/2022,,,Trustee of Pelican Park Community Trust. This is an unpaid role.,Unpaid role,https://interests-api.parliament.uk/api/v1/Interests/1264
1474,,"A Governor and a Member of the Council of Management, The Ditchley Foundation, an organisation that helps sustain peace, freedom and the rule of law; and works towards the renewal of democratic societies, states and alliances. This is an unpaid role.",2022-07-06,2023-12-17,,Miscellaneous,Rushanara Ali,4138,29/06/2022,,,"A Governor and a Member of the Council of Management, The Ditchley Foundation, an organisation that helps sustain peace, freedom and the rule of law; and works towards the renewal of democratic societies, states and alliances. This is an unpaid role.",Unpaid role,https://interests-api.parliament.uk/api/v1/Interests/1474
1606,,Member of the Town Board for Hereford. This is an unpaid role.,2020-02-05,2023-12-17,,Miscellaneous,Jesse Norman,3991,23/01/2020,,,Member of the Town Board for Hereford. This is an unpaid role.,Unpaid role,https://interests-api.parliament.uk/api/v1/Interests/1606
1610,,Chair of Governors at Rosslyn Park Primary & Nursery School in Nottingham. This is an unpaid position.,2023-04-13,2023-12-17,,Miscellaneous,Alex Norris,4641,,,,Chair of Governors at Rosslyn Park Primary & Nursery School in Nottingham. This is an unpaid position.,Unpaid role,https://interests-api.parliament.uk/api/v1/Interests/1610
1630,,Director of Kate Osborne Campaigns Ltd. This is an unpaid role.,2022-10-14,2023-12-17,,Miscellaneous,Kate Osborne,4783,06/10/2022,,,Director of Kate Osborne Campaigns Ltd. This is an unpaid role.,Unpaid role,https://interests-api.parliament.uk/api/v1/Interests/1630
1636,,Pharmacist registered with the General Pharmaceutical Council.,2021-05-21,2023-12-17,,Miscellaneous,Taiwo Owatemi,4779,24/04/2021,,,Pharmacist registered with the General Pharmaceutical Council.,Other,https://interests-api.parliament.uk/api/v1/Interests/1636
1667,,"A Trustee of a local charity, Phillipstown Residents and Community Association.",2023-03-09,2023-12-17,,Miscellaneous,Gerald Jones,4501,11/05/2018,,,"A Trustee of a local charity, Phillipstown Residents and Community Association.",Unpaid role,https://interests-api.parliament.uk/api/v1/Interests/1667
1690,,"Trustee (unpaid) of the Human Trafficking Foundation, a non-profit organisation which works to help victims of human trafficking and modern slavery. I consulted ACOBA about this role.",2020-11-05,2023-12-17,2021-03-04,Miscellaneous,Dame Karen Bradley,4110,01/11/2020,,,"Trustee (unpaid) of the Human Trafficking Foundation, a non-profit organisation which works to help victims of human trafficking and modern slavery. I consulted ACOBA about this role.",Unpaid role,https://interests-api.parliament.uk/api/v1/Interests/1690
1730,,"Unpaid Director of Richard Burgon Campaigns Ltd, a company established for my campaign to be Labour’s Deputy Leader and which continues to help deliver my campaigns work.",2023-03-24,2023-12-17,,Miscellaneous,Richard Burgon,4493,16/04/2020,,,"Unpaid Director of Richard Burgon Campaigns Ltd, a company established for my campaign to be Labour’s Deputy Leader and which continues to help deliver my campaigns work.",Unpaid role,https://interests-api.parliament.uk/api/v1/Interests/1730
1747,,Unremunerated Director of the Council for Arab-British Understanding.,2017-10-12,2023-12-17,,Miscellaneous,Mr Alistair Carmichael,1442,22/09/2017,,,Unremunerated Director of the Council for Arab-British Understanding.,Unpaid role,https://interests-api.parliament.uk/api/v1/Interests/1747
1832,,I am a member of the Rail Action Group East of Scotland (RAGES).,2017-06-26,2023-12-17,,Miscellaneous,John Lamont,4608,,,,I am a member of the Rail Action Group East of Scotland (RAGES).,Other,https://interests-api.parliament.uk/api/v1/Interests/1832
1850,,Vice President of the Local Government Association (LGA). This is an unpaid role.,2022-07-25,2023-12-17,,Miscellaneous,Paulette Hamilton,4938,28/06/2022,,,Vice President of the Local Government Association (LGA). This is an unpaid role.,Unpaid role,https://interests-api.parliament.uk/api/v1/Interests/1850
1866,,"Equality, Diversity and Inclusion Trustee for Swansea City AFC Foundation. This is an unpaid role.",2022-09-26,2023-12-17,,Miscellaneous,Carolyn Harris,4480,26/08/2022,,,"Equality, Diversity and Inclusion Trustee for Swansea City AFC Foundation. This is an unpaid role.",Unpaid role,https://interests-api.parliament.uk/api/v1/Interests/1866
2052,,A trustee of the Good Chance Theatre Company. This is an unpaid role.,2019-03-21,2023-12-17,,Miscellaneous,Tulip Siddiq,4518,27/02/2019,,,A trustee of the Good Chance Theatre Company. This is an unpaid role.,Unpaid role,https://interests-api.parliament.uk/api/v1/Interests/2052
2119,,"Trustee, East Thirteen Christian Trust.",2018-05-10,2023-12-17,,Miscellaneous,Sir Stephen Timms,163,,,,"Trustee, East Thirteen Christian Trust.",Unpaid role,https://interests-api.parliament.uk/api/v1/Interests/2119
2121,,"Trustee, Parliamentary Christian Trust.",2018-05-10,2023-12-17,,Miscellaneous,Sir Stephen Timms,163,,,,"Trustee, Parliamentary Christian Trust.",Unpaid role,https://interests-api.parliament.uk/api/v1/Interests/2121
1409,,"Board member of POWERful Women (PfW), a professional initiative to advance gender diversity within the energy sector.",2018-11-01,2023-12-17,,Miscellaneous,Ed Davey,188,14/09/2017,,,"Board member of POWERful Women (PfW), a professional initiative to advance gender diversity within the energy sector.",Unpaid role,https://interests-api.parliament.uk/api/v1/Interests/1409
1416,,"Unremunerated board member, New City Network (London) Ltd; a not-for-profit think tank aiming to develop ideas and research on financial services policy.",2023-04-17,2023-12-17,,Miscellaneous,David Davis,373,,,,"Unremunerated board member, New City Network (London) Ltd; a not-for-profit think tank aiming to develop ideas and research on financial services policy.",Unpaid role,https://interests-api.parliament.uk/api/v1/Interests/1416
1963,,"Chair of the advisory board of the Space Energy Initiative, a non-profit organisation set up within the Satellite Applications Catapult to support those exploring the possibility of space based solar power. This is an unpaid role and involves chairing four meetings a year.",2021-12-14,2023-12-17,,Miscellaneous,Mark Garnier,4074,22/11/2021,,,"Chair of the advisory board of the Space Energy Initiative, a non-profit organisation set up within the Satellite Applications Catapult to support those exploring the possibility of space based solar power. This is an unpaid role and involves chairing four meetings a year.",Unpaid role,https://interests-api.parliament.uk/api/v1/Interests/1963
1449,,A company to which a subsidiary of Pluto Partners LLP provides services became accredited for the Coronavirus Business Interruption Loan Scheme.,2021-05-25,2023-12-17,,Miscellaneous,Chris Philp,4503,22/03/2021,,,A company to which a subsidiary of Pluto Partners LLP provides services became accredited for the Coronavirus Business Interruption Loan Scheme.,Other,https://interests-api.parliament.uk/api/v1/Interests/1449
2014,,An ambassador for Spring Housing Association.,2017-07-05,2023-12-17,2020-12-08,Miscellaneous,Preet Kaur Gill,4603,29/09/2020,,,An ambassador for Spring Housing Association.,Other,https://interests-api.parliament.uk/api/v1/Interests/2014
1974,,Fellow of the Royal College of Veterinary Surgeons.,2020-01-07,2023-12-17,,Miscellaneous,Dr Neil Hudson,4853,,,,Fellow of the Royal College of Veterinary Surgeons.,Other,https://interests-api.parliament.uk/api/v1/Interests/1974
1987,,Portfolio of shares held in a blind trust.,2019-10-29,2023-12-17,,Miscellaneous,Jeremy Hunt,1572,,,,Portfolio of shares held in a blind trust.,Financial interest or material benefit,https://interests-api.parliament.uk/api/v1/Interests/1987
1255,,Member of the King’s Lynn Town Deal Board. This is an unpaid role.,2020-01-30,2023-12-17,,Miscellaneous,James Wild,4787,29/01/2020,,,Member of the King’s Lynn Town Deal Board. This is an unpaid role.,Unpaid role,https://interests-api.parliament.uk/api/v1/Interests/1255
1256,,"Governor, King Edward VII Academy. This is an unpaid position on the Academy Committee.",2021-11-08,2023-12-17,,Miscellaneous,James Wild,4787,03/11/2021,,,"Governor, King Edward VII Academy. This is an unpaid position on the Academy Committee.",Unpaid role,https://interests-api.parliament.uk/api/v1/Interests/1256
